78,239684808,縫雙眼皮後瘀血怎麼辦ಥ_ಥ,想請問大家縫完雙眼皮後如果眼睛有瘀血的話都怎麼處理的…我瘀血好久了 都沒有消退,255fd275-fec2-49d2-8e46-2e1557ffaeb0,,2022-08-12 11:07:24.639000+00:00,0,0,['雙眼皮'],閒聊,,[],縫雙眼皮後瘀血怎麼辦ಥ_ಥ想請問大家縫完雙眼皮後如果眼睛有瘀血話都怎麼處理我瘀血好久了都沒有消退,"['縫', '雙眼', '皮後瘀', '血', '怎麼辦', 'ಥ', '_', 'ಥ', '想', '請問', '大家', '縫', '完雙', '眼皮', '後', '如果', '眼睛', '有', '瘀', '血話', '都', '怎麼', '處理', '我', '瘀', '血', '好久', '了', '都', '沒有', '消退']"
79,239684779,IG收藏的封面,不知道大家是不是都會在IG裡面收藏一些美食景點啊之類的東西，珍藏裡面還可以分類，像我就分成台灣各個縣市，這樣以後要找也比較好找。不過分類的首圖只能從該分類裡面選擇，因此會覺得非常雜亂，每次新增一個都要,255fd275-fec2-49d2-8e46-2e1557ffaeb0,,2022-08-12 11:03:41.714000+00:00,1,0,"['ig', '收藏', '封面']",閒聊,,[],IG收藏封面不知道大家是不是都會在IG裡面收藏一些美食景點啊之類東西珍藏裡面還可以分類像我就分成台灣各個縣市這樣以後要找也比較好找不過分類首圖只能從該分類裡面選擇因此會覺得非常雜亂每次新增一個都要,"['IG', '收藏', '封面', '不知道', '大家', '是', '不是', '都', '會', '在', 'IG', '裡面', '收藏', '一些', '美食', '景點', '啊', '之類', '東西', '珍藏裡', '面還', '可以', '分類', '像', '我', '就', '分成', '台灣', '各個', '縣市', '這樣', '以後', '要', '找', '也', '比', '較', '好找', '不過', '分類', '首圖', '只能', '從', '該', '分類', '裡面', '選擇', '因此', '會', '覺得', '非常雜', '亂', '每次', '新增', '一個', '都', '要']"
80,239684772,高雄台北哪間星巴克很大間,最近想買星巴克的馬克杯 想說規模大間的星巴克應該賣的杯子也比較多樣，想請問大家知道台北或高雄哪間星巴克很大或是賣的杯子很多嗎QQ,255fd275-fec2-49d2-8e46-2e1557ffaeb0,,2022-08-12 11:02:17.440000+00:00,6,6,"['高雄', '台北', '星巴克']",閒聊,,[],高雄台北哪間星巴克很大間最近想買星巴克馬克杯想說規模大間星巴克應該賣杯子也比較多樣想請問大家知道台北或高雄哪間星巴克很大或是賣杯子很多嗎QQ,"['高雄', '台北', '哪間', '星', '巴克', '很', '大間', '最近', '想買', '星', '巴克', '馬', '克杯', '想', '說', '規模', '大間', '星', '巴克', '應該', '賣杯子', '也', '比', '較', '多樣', '想', '請問', '大家', '知道', '台北', '或', '高雄', '哪間', '星', '巴克', '很大', '或是', '賣杯子', '很多', '嗎', 'QQ']"
81,239684764,90年代的年輕人是不是最可悲？,剛好到了成家立業的年紀，房價剛好漲到飛天，政府也無能沒辦法管，我年薪250都覺得壓力很大，（有車貸3萬/月，一台轎車一台貨車），純抒發討論,255fd275-fec2-49d2-8e46-2e1557ffaeb0,,2022-08-12 11:01:19.486000+00:00,5,2,"['90年代', '買房']",閒聊,,[],90年代年輕人是不是最可悲剛好到了成家立業年紀房價剛好漲到飛天政府也無能沒辦法管我年薪250都覺得壓力很大有車貸3萬月一台轎車一台貨車純抒發討論,"['90', '年代', '年輕人', '是', '不是', '最', '可悲', '剛好', '到', '了', '成家立業', '年紀', '房價', '剛好', '漲到', '飛天政府', '也', '無能', '沒辦', '法管', '我', '年薪', '250', '都', '覺得', '壓力', '很大', '有', '車貸', '3', '萬月', '一台', '轎車', '一台', '貨車', '純抒發', '討論']"
82,239684753,一招就收服男友爸的心🤭,聽男友說男友爸是一個嚴謹的獅子座爸爸，上禮拜男友爸生日第一次到他們家去，平常愛嘻嘻哈哈的我緊張到爆，而且又是一年一度的生日，要去拜訪前我真的想破頭腦，不知道要帶什麼去拜訪才好，最後跟男友討論就買個生日,255fd275-fec2-49d2-8e46-2e1557ffaeb0,,2022-08-12 11:00:12.617000+00:00,7,6,"['男朋友', '生日蛋糕']",閒聊,,[],一招就收服男友爸心🤭聽男友說男友爸是一個嚴謹獅子座爸爸上禮拜男友爸生日第一次到他們家去平常愛嘻嘻哈哈我緊張到爆而且又是一年一度生日要去拜訪前我真想破頭腦不知道要帶什麼去拜訪才好最後跟男友討論就買個生日,"['一招', '就', '收服', '男友', '爸心', '🤭', '聽', '男友', '說', '男友', '爸', '是', '一個', '嚴謹', '獅子', '座', '爸爸', '上禮', '拜', '男友', '爸生', '日', '第', '一次', '到', '他們', '家去', '平', '常愛', '嘻嘻哈哈', '我緊', '張到', '爆而且', '又', '是', '一年一度', '生日', '要', '去', '拜', '訪前', '我', '真想', '破頭腦', '不知道', '要', '帶', '什麼', '去', '拜訪', '才', '好', '最', '後', '跟', '男友', '討論', '就', '買個', '生日']"
83,239684690,該勾結境外勢力的時候就要勾結,中共成天以中華民族的偉大復興來洗腦中國韭菜，民族大義喊的震天響，如同糖衣毒藥讓中國韭菜吃了就忘記過去受過的委屈，如河南村鎮銀行不給儲戶提款、爛尾樓房得不到解決及疫情清零導致諸多慘絕人寰的悲劇等問題，只,255fd275-fec2-49d2-8e46-2e1557ffaeb0,,2022-08-12 10:51:30.756000+00:00,2,0,"['中國', '生活', '閒聊', '境外']",閒聊,,[],該勾結境外勢力時候就要勾結中共成天以中華民族偉大復興來洗腦中國韭菜民族大義喊震天響如同糖衣毒藥讓中國韭菜吃了就忘記過去受過委屈如河南村鎮銀行不給儲戶提款爛尾樓房得不到解決及疫情清零導致諸多慘絕人寰悲劇等問題只,"['該', '勾結', '境外', '勢力', '時候', '就要', '勾結', '中共', '成天', '以', '中華民族', '偉大', '復興', '來', '洗腦', '中國', '韭菜民族', '大義', '喊震', '天響', '如同', '糖衣', '毒藥', '讓', '中國', '韭菜', '吃', '了', '就', '忘記', '過去', '受過', '委屈', '如河', '南村鎮', '銀行', '不給', '儲戶', '提款爛', '尾樓', '房', '得不到', '解決', '及', '疫情', '清零', '導致', '諸多', '慘絕人寰', '悲劇', '等', '問題', '只']"
84,239684636,游泳完後腳上長了超多密集的紅斑🥲,有人也有一樣的經驗嗎？不知道是不是游泳造成的，剛好游泳完隔天整隻腳長滿，不痛也不癢 就是很醜這樣，不知道哪時候才會消……下禮拜要穿比基尼⋯⋯不想破壞美感喇,255fd275-fec2-49d2-8e46-2e1557ffaeb0,,2022-08-12 10:44:57.077000+00:00,1,0,"['游泳', '紅斑']",閒聊,,"[{'url': 'https://imgur.com/qbDtzyu.jpg'}, {'url': 'https://imgur.com/iAYP5ir.jpg'}]",游泳完後腳上長了超多密集紅斑🥲有人也有一樣經驗嗎不知道是不是游泳造成剛好游泳完隔天整隻腳長滿不痛也不癢就是很醜這樣不知道哪時候才會消下禮拜要穿比基尼⋯⋯不想破壞美感喇,"['游泳', '完', '後腳', '上長', '了', '超多', '密集', '紅斑', '\U0001f972', '有', '人', '也', '有', '一樣', '經驗', '嗎', '不知道', '是', '不是', '游泳', '造成', '剛好', '游泳', '完隔', '天整', '隻', '腳長', '滿', '不痛', '也', '不癢', '就是', '很醜', '這樣', '不知道', '哪時候', '才', '會消', '下禮拜', '要', '穿', '比', '基尼', '⋯', '⋯', '不想', '破壞', '美感', '喇']"
85,239684592,如果你也覺得臺灣交通很爛,如果你平常騎車、開車、甚至走在路上，曾經有過「交通設計也太爛了吧」的想法，對於這些沒時間、不知道或不想站出來的一般百姓來說，有一件事能做 而且很簡單，當別人出來爭取，至少不要不去了解訴求就講一堆垃圾話,255fd275-fec2-49d2-8e46-2e1557ffaeb0,239679660.0,2022-08-12 10:39:31.722000+00:00,2,5,"['台灣人', '交通', '生活']",閒聊,【轉載】被強姦到麻木的台灣人，以及每天強姦人的交通,[],如果你也覺得臺灣交通很爛如果你平常騎車開車甚至走在路上曾經有過交通設計也太爛了吧想法對於這些沒不知道或不想站出來一般百姓來說有一件事能做而且很簡單當別人出來爭取至少不要不去了解訴求就講一堆垃圾話,"['如果', '你', '也', '覺得', '臺', '灣', '交通', '很爛', '如果', '你', '平常', '騎車', '開車', '甚至', '走', '在', '路上', '曾經', '有過', '交通', '設計', '也', '太爛', '了', '吧', '想法', '對於', '這些', '沒', '不知道', '或', '不想', '站', '出來', '一般', '百姓', '來說', '有', '一件', '事能', '做', '而', '且', '很', '簡單當', '別人', '出來', '爭取', '至少', '不要', '不去', '了解', '訴求', '就講', '一堆', '垃圾', '話']"
86,239684568,疝氣,21,255fd275-fec2-49d2-8e46-2e1557ffaeb0,,2022-08-12 10:36:55.351000+00:00,0,1,"['有趣', '閒聊', '冷笑話']",閒聊,,[],疝氣21,"['疝氣', '21']"
87,239684472,🌟新加坡商立可人事第二屆校園大使招募開跑🌟,哈囉大家好我們是新加坡商立可人事，目前在招募校園大使，歡迎有興趣的同學申請，#內抽千元專業履歷健檢，新加坡商立可人事第二屆校園大使招募計畫，即日起開始報名，我是這樣的人…，️創意點子滿滿卻沒舞台發揮，️喜,255fd275-fec2-49d2-8e46-2e1557ffaeb0,,2022-08-12 10:23:45.890000+00:00,0,0,"['校園', '大使', '校園大使', '實習', '行銷']",閒聊,,[{'url': 'https://imgur.com/D9wFPfU.jpg'}],🌟新加坡商立可人事第二屆校園大使招募開跑🌟哈囉大家好我們是新加坡商立可人事目前在招募校園大使歡迎有興趣同學申請內抽千元專業履歷健檢新加坡商立可人事第二屆校園大使招募計畫即日起開始報名我是這樣人️創意點子滿滿卻沒舞台發揮️喜,"['🌟', '新加坡', '商立', '可', '人事', '第', '二屆', '校園', '大使', '招募', '開跑', '🌟', '哈囉', '大家', '好', '我們', '是', '新', '加坡', '商立', '可', '人事', '目前', '在', '招募', '校園', '大使', '歡迎', '有', '興趣', '同學', '申請', '內', '抽', '千元', '專業', '履歷', '健檢新', '加坡', '商立', '可', '人事', '第', '二屆', '校園', '大使', '招募', '計畫', '即日起', '開始', '報名', '我', '是', '這樣', '人', '️', '創意', '點子', '滿滿', '卻', '沒舞台', '發揮', '️', '喜']"
88,239684458,小智退選了😢支持鄭運鵬,選舉的抹黑真可怕，小英跟全民進黨都救不起來，希望小智好好休息，過幾年再來參選，年底全力支持鄭運鵬！，希望台灣更好、解決少子化，國家才有競爭力！,255fd275-fec2-49d2-8e46-2e1557ffaeb0,,2022-08-12 10:21:53.121000+00:00,32,17,"['時事', '政治', '新竹', '台灣人', '健忘']",閒聊,,[],小智退選了😢支持鄭運鵬選舉抹黑真可怕小英跟全民進黨都救不起來希望小智好好休息過幾年再來參選年底全力支持鄭運鵬希望台灣更好解決少子化國家才有競爭力,"['小智', '退選', '了', '😢', '支持', '鄭運鵬', '選舉', '抹', '黑真', '可怕', '小英', '跟', '全民', '進黨', '都', '救', '不', '起來', '希望', '小智', '好好', '休息', '過', '幾年', '再來', '參選', '年底', '全力支持', '鄭運鵬', '希望', '台灣', '更', '好', '解決', '少子', '化', '國家', '才', '有', '競爭力']"
89,239684446,新世界聖戰軍 每日正妹精選 日行一善 Day5,每天散播愛與和平的正能量，推動世界和平是我的使命~，祈請大家一起響應，日行一善，對世界付出你的一分善良，看好了世界 我們台灣人是第一個實現愛與和平，地球烏托邦世界模範公民！，歡迎追蹤我 每日提振精神！,255fd275-fec2-49d2-8e46-2e1557ffaeb0,,2022-08-12 10:20:37.496000+00:00,0,1,"['正妹', '感情', '男友', '時事', '有趣']",閒聊,,"[{'url': 'https://imgur.com/hwh6416.jpg'}, {'url': 'https://imgur.com/p8KsXdo.jpg'}, {'url': 'https://imgur.com/jxLdvde.jpg'}, {'url': 'https://imgur.com/1z6qN5M.jpg'}, {'url': 'https://imgur.com/Fv3yFDL.jpg'}, {'url': 'https://imgur.com/2WSAcoF.jpg'}, {'url': 'https://imgur.com/6oN9NZT.jpg'}, {'url': 'https://imgur.com/PlHMN4t.jpg'}, {'url': 'https://imgur.com/wZnMxMt.jpg'}, {'url': 'https://imgur.com/xJnhTpH.jpg'}]",新世界聖戰軍每日正妹精選日行一善Day5每天散播愛與和平正能量推動世界和平是我使命祈請大家一起響應日行一善對世界付出你一分善良看好了世界我們台灣人是第一個實現愛與和平地球烏托邦世界模範公民歡迎追蹤我每日提振精神,"['新', '世界', '聖', '戰軍', '每日', '正妹', '精選', '日行', '一善', 'Day5', '每天', '散播', '愛與', '和', '平正', '能量', '推動', '世界', '和平', '是', '我', '使命', '祈請', '大家', '一起', '響應', '日行', '一善', '對', '世界', '付出', '你', '一分', '善良', '看好', '了', '世界', '我們', '台灣', '人', '是', '第', '一個', '實現', '愛與', '和平', '地球', '烏托邦', '世界', '模範', '公民', '歡迎', '追', '蹤', '我', '每', '日', '提', '振', '精', '神']"
90,239684388,臍帶章,剛剛得知我媽有去訂做肚臍印章，就是裡面有一段小臍帶，底下是名字，當時我媽本來要做，但是要5.6000一個，於是我媽就覺得很貴就沒做，後來她把臍帶用紅包袋裝著，就這麼放在錢包裡帶著快20年，然後最近才拿,255fd275-fec2-49d2-8e46-2e1557ffaeb0,,2022-08-12 10:12:26.852000+00:00,2,0,"['有趣', '閒聊']",閒聊,,[{'url': 'https://imgur.com/FYj6pVu.jpg'}],臍帶章剛剛得知我媽有去訂做肚臍印章就是裡面有一段小臍帶底下是名字當時我媽本來要做但是要56000一個於是我媽就覺得很貴就沒做後來她把臍帶用紅包袋裝著就這麼放在錢包裡帶著快20年然後最近才拿,"['臍', '帶章', '剛剛', '得知', '我媽', '有', '去', '訂', '做', '肚臍', '印章', '就是', '裡面', '有', '一段', '小臍帶', '底下', '是', '名字', '當時', '我', '媽本來', '要', '做', '但是', '要', '56000', '一個', '於是', '我媽', '就', '覺得', '很貴', '就', '沒', '做', '後來', '她', '把', '臍', '帶', '用紅', '包袋', '裝著', '就', '這麼', '放', '在', '錢', '包裡', '帶', '著快', '20', '年', '然後', '最近', '才', '拿']"
91,239684352,知無不言  終版,Hi，各位。和大家的交流已有一週，陸陸續續會有人會提出自己的問題，One先生也受益良多，然後之前的文可能被隱藏了。如題，這一篇是最後一版啦，這次我不會刪文也不會隱藏，我會慢慢整理大家問得最多的問題到文,255fd275-fec2-49d2-8e46-2e1557ffaeb0,,2022-08-12 10:05:42.691000+00:00,12,12,['閒聊'],閒聊,,[],知無不言終版Hi各位和大家交流已有一週陸陸續續會有人會提出自己問題One先生也受益良多然後之前文可能被隱藏了如題這一篇是最後一版啦這次我不會刪文也不會隱藏我會慢慢整理大家問得最多問題到文,"['知無', '不言', '終版', 'Hi', '各位', '和', '大家', '交流', '已有', '一週', '陸陸續續', '會', '有', '人會', '提', '出自', '己', '問題', 'One', '先生', '也', '受益', '良多', '然後', '之', '前文', '可能', '被', '隱藏', '了', '如題', '這', '一篇', '是', '最後一版', '啦', '這次', '我', '不會', '刪文', '也', '不會', '隱藏', '我會', '慢慢', '整理', '大家', '問得', '最多', '問題', '到文']"
92,239684348,一個月15萬的對話…？,如題，今天下午媽在房間裡講電話講得很開心，我在客廳哄我妹睡午覺（小嬰兒），但她講話的聲音很大聲客廳都聽得到，我經過她房門看了一眼笑的跟小女人似的⋯⋯，覺得怪怪的🤨她平常是很火爆的個性，因為我太好奇了後,255fd275-fec2-49d2-8e46-2e1557ffaeb0,,2022-08-12 10:04:46.044000+00:00,109,616,"['家庭', '媽媽']",閒聊,,"[{'url': 'https://imgur.com/h7Bcqui.jpg'}, {'url': 'https://imgur.com/ReQiwht.jpg'}]",一個月15萬對話如題今天下午媽在房間裡講電話講得很開心我在客廳哄我妹睡午覺小嬰兒但她講話聲音很大聲客廳都聽得到我經過她房門看了一眼笑跟小女人似⋯⋯覺得怪怪🤨她平常是很火爆個性因為我太好奇了後,"['一個月', '15', '萬', '對話', '如題', '今天下午', '媽在', '房間', '裡講', '電話', '講得', '很', '開心', '我', '在', '客廳', '哄', '我妹', '睡', '午覺', '小', '嬰兒', '但', '她', '講話', '聲音', '很', '大聲', '客廳', '都', '聽', '得到', '我', '經過', '她', '房門', '看', '了', '一眼', '笑', '跟', '小', '女人', '似', '⋯', '⋯', '覺得', '怪怪', '🤨', '她', '平常', '是', '很', '火爆', '個性', '因為', '我', '太', '好奇', '了', '後']"
93,239684346,台灣選出這種睜眼說瞎話的總統 恐怕才是最悲哀的吧,一個總統，可以為了選舉睜眼說瞎話，無限力挺做錯事的人，就只因為是同黨的，到底是總統為國為民操心呢？ 還是只是一個選舉主席裝作總統而已呢？這格局實在是低落，最可悲的是她還是人民選出來的（包括本人）！ 實,255fd275-fec2-49d2-8e46-2e1557ffaeb0,,2022-08-12 10:04:17.882000+00:00,3,1,"['論文', '悲哀', '可悲', '台灣', '總統']",閒聊,,[],台灣選出這種睜眼說瞎話總統恐怕才是最悲哀吧一個總統可以為了選舉睜眼說瞎話無限力挺做錯事人就只因為是同黨到底是總統為國為民操心呢還是只是一個選舉主席裝作總統而已呢這格局實在是低落最可悲是她還是人民選出來包括本人實,"['台灣', '選出', '這種睜眼', '說', '瞎', '話', '總統', '恐怕', '才', '是', '最', '悲哀', '吧', '一個', '總統', '可以', '為', '了', '選舉睜眼', '說', '瞎', '話', '無限力', '挺', '做錯事', '人', '就', '只', '因為', '是', '同黨', '到底', '是', '總統', '為', '國為民', '操心', '呢', '還是', '只是', '一個', '選舉', '主席', '裝作', '總統', '而', '已', '呢', '這格局', '實在', '是', '低落', '最', '可悲', '是', '她', '還是', '人民', '選', '出來', '包括', '本人實']"
94,239684342,為何一定要故意打錯名字？,人家父母明明給他取“林智堅”，你們偏要把人家改成“林志堅”，我真的想了解這到底是為著啥？,255fd275-fec2-49d2-8e46-2e1557ffaeb0,,2022-08-12 10:03:41.092000+00:00,5,3,"['政治', '選舉']",閒聊,,[],為何一定要故意打錯名字人家父母明明給他取林智堅你們偏要把人家改成林志堅我真想了解這到底是為著啥,"['為何', '一定要', '故意', '打錯', '名字', '人家', '父母', '明明給', '他', '取林智堅', '你們', '偏要', '把', '人家', '改', '成林', '志堅', '我', '真想', '了解', '這', '到底', '是', '為', '著', '啥']"
95,239684301,google式答覆,快被B2笑死,255fd275-fec2-49d2-8e46-2e1557ffaeb0,239679510.0,2022-08-12 09:57:40.948000+00:00,1,2,"['好笑', '保重身體']",閒聊,玩手機胸部被小小電到,[{'url': 'https://imgur.com/KTm2Ctb.jpg'}],google式答覆快被B2笑死,"['google', '式', '答覆快', '被', 'B2', '笑', '死']"
96,239684276,為什麼北韓不會整天想統一南韓？,如題，大家都知道小恩恩跟小平平是一對瘋瘋的好兄弟，小平平每天都想統一灣灣，小恩恩那邊怎麼都沒有跟進呢？,255fd275-fec2-49d2-8e46-2e1557ffaeb0,,2022-08-12 09:54:52.495000+00:00,79,175,"['統一', '北韓']",閒聊,,[],為什麼北韓不會整天想統一南韓如題大家都知道小恩恩跟小平平是一對瘋瘋好兄弟小平平每天都想統一灣灣小恩恩那邊怎麼都沒有跟進呢,"['為什麼', '北韓', '不會', '整天', '想統', '一', '南韓', '如題', '大家', '都', '知道', '小恩恩', '跟', '小', '平平', '是', '一對', '瘋瘋好', '兄弟', '小', '平平', '每', '天都', '想統', '一灣灣', '小恩恩', '那邊', '怎麼', '都', '沒有', '跟', '進', '呢']"
97,239684249,禿頭前兆,請問各位這樣算禿頭前兆嗎⋯⋯，明明自己才20幾歲 因為當兵剪頭髮之後才發現自己好像有禿頭 可是爸爸阿公都沒有，想請問是不是作息不正常的關係 調作息之後會正常嗎？  或是有什麼方法可以補救，真的不想以後,255fd275-fec2-49d2-8e46-2e1557ffaeb0,,2022-08-12 09:50:55.687000+00:00,25,6,"['禿頭', '徵兆']",閒聊,,[{'url': 'https://imgur.com/jb8eJqo.jpg'}],禿頭前兆請問各位這樣算禿頭前兆嗎⋯⋯明明自己才20幾歲因為當兵剪頭髮之後才發現自己好像有禿頭可是爸爸阿公都沒有想請問是不是作息不正常關係調作息之後會正常嗎或是有什麼方法可以補救真不想以後,"['禿頭', '前兆', '請問', '各位', '這樣', '算禿頭', '前兆', '嗎', '⋯', '⋯', '明明', '自己', '才', '20', '幾歲', '因為', '當兵', '剪頭髮', '之後', '才', '發現', '自己', '好像', '有禿頭', '可是', '爸爸', '阿公都', '沒有', '想', '請', '問是', '不是', '作息', '不正', '常', '關係', '調', '作息', '之', '後會', '正常', '嗎', '或是', '有', '什麼', '方法', '可以', '補救', '真', '不想', '以後']"
98,239684242,#詢問 指定美髮設計師 潛規則,（不確定能不能發這個版，若不行會再撤～），這邊有件事困擾我蠻久的，如果我今天去了一家第一次去的理髮廳，指定了設計師A弄頭髮，成果蠻滿意的，但就是沒有到一百分的喜歡。之後發現同一家理髮廳的設計師B的作品,255fd275-fec2-49d2-8e46-2e1557ffaeb0,,2022-08-12 09:49:54.229000+00:00,1,0,"['美髮', '設計師']",閒聊,,[],詢問指定美髮設計師潛規則不確定能不能發這個版若不行會再撤這邊有件事困擾我蠻久如果我今天去了一家第一次去理髮廳指定了設計師A弄頭髮成果蠻滿意但就是沒有到一百分喜歡之後發現同一家理髮廳設計師B作品,"['詢問', '指定', '美', '髮', '設計師', '潛規則', '不確', '定能', '不能', '發', '這個', '版', '若', '不行', '會', '再', '撤', '這邊', '有件', '事', '困擾', '我蠻', '久', '如果', '我', '今天', '去', '了', '一家', '第', '一次', '去理', '髮', '廳', '指定', '了', '設計師', 'A', '弄頭', '髮', '成果', '蠻', '滿意', '但', '就是', '沒有', '到', '一百分', '喜歡', '之', '後發', '現同', '一家', '理', '髮', '廳', '設計師', 'B', '作品']"
99,239684214,週末又要來抽獎啦‼️,留言就有機會參加抽獎喔，#消防，#抽獎，#好康,255fd275-fec2-49d2-8e46-2e1557ffaeb0,,2022-08-12 09:46:32+00:00,0,0,"['抽獎', '抽獎活動', '週末', '消防']",閒聊,,[{'url': 'https://imgur.com/J6hVyvp.jpg'}],週末又要來抽獎啦‼️留言就有機會參加抽獎喔消防抽獎好康,"['週末', '又', '要', '來', '抽獎', '啦', '‼', '️', '留言', '就', '有', '機會', '參加', '抽獎', '喔', '消防', '抽獎', '好康']"
100,239684206,韓素希姐姐 要沒事啊,今天在微博看到，韓姐姐的貼文風格 跟雪莉很像，希望韓姐姐要平安啊,255fd275-fec2-49d2-8e46-2e1557ffaeb0,239669070.0,2022-08-12 09:45:21.284000+00:00,1,10,"['韓韶禧', '貼文']",閒聊,#詢問 韓韶禧的貼文還好嗎...💧,[],韓素希姐姐要沒事啊今天在微博看到韓姐姐貼文風格跟雪莉很像希望韓姐姐要平安啊,"['韓素', '希', '姐姐', '要', '沒事', '啊', '今天', '在', '微博看', '到韓', '姐姐', '貼文風格', '跟', '雪莉', '很', '像', '希望', '韓', '姐姐', '要', '平安', '啊']"
101,239684196,體重計是不是壞掉了😰,有幾次，我量完體重，量完沒多久就有上廁所的感覺，中間也沒有進食，廁所結束，想說量一下有沒有減少，結果，沒減少就算了，竟然還增加0.2，量了2、3次都一樣，這種情況遇到2次吧，每次都懷疑自己，再懷疑體重,255fd275-fec2-49d2-8e46-2e1557ffaeb0,,2022-08-12 09:43:56.067000+00:00,4,0,"['體重', '體重計', '神奇海螺會不會知道']",閒聊,,[],體重計是不是壞掉了😰有幾次我量完體重量完沒多久就有上廁所感覺中間也沒有進食廁所結束想說量一下有沒有減少結果沒減少就算了竟然還增加02量了23次都一樣這種情況遇到2次吧每次都懷疑自己再懷疑體重,"['體重計', '是', '不是', '壞掉', '了', '😰', '有', '幾次', '我量', '完體', '重量', '完', '沒', '多久', '就', '有', '上', '廁所', '感覺', '中間', '也', '沒有', '進食', '廁所', '結束', '想', '說量', '一', '下有', '沒有', '減少', '結果', '沒', '減少', '就算', '了', '竟然還', '增加', '02', '量', '了', '23', '次', '都', '一樣', '這種', '情況', '遇到', '2', '次', '吧', '每次', '都', '懷疑', '自己', '再', '懷疑', '體重']"
