102,239684169,我好奇關於所謂“矮男”的這些,*我剛加入，如有違反版規，請跟我說一下~我會刪文，我看一堆回覆，藍粉有時會互相說，例如：粉指控藍，只在乎大小，藍就會說，粉還不是說175以下半殘，矮男什麼怎麼的，，看迪卡後，突然好奇，很多女生嫌男生矮,255fd275-fec2-49d2-8e46-2e1557ffaeb0,,2022-08-12 09:40:51.312000+00:00,5,0,"['閒聊', '男生']",閒聊,,[],我好奇關於所謂矮男這些我剛加入如有違反版規請跟我說一下我會刪文我看一堆回覆藍粉有時會互相說例如粉指控藍只在乎大小藍就會說粉還不是說175以下半殘矮男什麼怎麼看迪卡後突然好奇很多女生嫌男生矮,"['我', '好奇', '關於', '所謂', '矮', '男', '這些', '我剛', '加入', '如有', '違反版', '規請', '跟', '我', '說', '一下', '我會', '刪文', '我', '看', '一堆', '回覆', '藍粉', '有', '時會', '互相', '說', '例如', '粉指', '控藍', '只在乎', '大小', '藍', '就', '會', '說', '粉還', '不是', '說', '175', '以下', '半殘', '矮', '男', '什麼', '怎麼', '看迪卡', '後', '突然', '好奇', '很多', '女生', '嫌', '男生', '矮']"
103,239684126,電動公車,到底為什麼每次搭電動公車，都沒冷氣，每次都熱到靠北，冷氣口吹出來的是熱風，干，我就想問，公車司機是不熱嗎，搭公車搭到快中暑欸,255fd275-fec2-49d2-8e46-2e1557ffaeb0,,2022-08-12 09:36:25.835000+00:00,2,1,"['電動', '公車']",閒聊,,[],電動公車到底為什麼每次搭電動公車都沒冷氣每次都熱到靠北冷氣口吹出來是熱風干我就想問公車司機是不熱嗎搭公車搭到快中暑欸,"['電動', '公車', '到底', '為什麼', '每次', '搭', '電動', '公車', '都', '沒', '冷氣', '每次', '都', '熱到', '靠北', '冷氣', '口', '吹', '出來', '是', '熱風', '干', '我', '就', '想問', '公車', '司機', '是', '不熱', '嗎', '搭', '公車', '搭到', '快', '中暑', '欸']"
104,239684120,林智堅退選了，準備升官了,退選桃園市長，等風頭過去後，準備升官發財了，民進黨萬歲，這場風波除了台大沒人受傷,255fd275-fec2-49d2-8e46-2e1557ffaeb0,,2022-08-12 09:35:10.765000+00:00,9,9,['林智堅'],閒聊,,[],林智堅退選了準備升官了退選桃園市長等風頭過去後準備升官發財了民進黨萬歲這場風波除了台大沒人受傷,"['林智堅', '退選', '了', '準備', '升官', '了', '退', '選桃園', '市長', '等', '風頭過', '去', '後', '準備', '升官發財', '了', '民進', '黨', '萬歲', '這場', '風波', '除了', '台大', '沒人', '受傷']"
105,239684110,台中夜店,今天來台中玩 想去夜店喝一杯，有人也想一起的嗎,255fd275-fec2-49d2-8e46-2e1557ffaeb0,,2022-08-12 09:34:19.326000+00:00,3,0,"['台中', '夜店']",閒聊,,[],台中夜店今天來台中玩想去夜店喝一杯有人也想一起嗎,"['台中', '夜店', '今天', '來台', '中', '玩', '想', '去', '夜店', '喝一杯', '有', '人', '也', '想', '一起', '嗎']"
106,239684101,林智堅：都是國民黨的錯 抹黑我,我去聽了林智堅的退選原因，總結就是：1.我是清白的，我要捍衛自己，2.我坦然離開，3.國民黨造謠抹黑，千錯萬錯都是別人的錯🤪,255fd275-fec2-49d2-8e46-2e1557ffaeb0,,2022-08-12 09:33:29.484000+00:00,73,294,"['閒聊', '林智堅', '國民黨', '抹黑']",閒聊,,"[{'url': 'https://imgur.com/QPjie7x.jpg'}, {'url': 'https://imgur.com/AUCxwbr.jpg'}, {'url': 'https://imgur.com/CGb5rwj.jpg'}, {'url': 'https://imgur.com/9KdVUQu.jpg'}, {'url': 'https://imgur.com/CPTloVQ.jpg'}, {'url': 'https://imgur.com/y92r7U4.jpg'}, {'url': 'https://imgur.com/1lU1h3n.jpg'}, {'url': 'https://imgur.com/xcdfVgD.jpg'}, {'url': 'https://imgur.com/3m6TC8h.jpg'}, {'url': 'https://imgur.com/Lvlz9xI.jpg'}, {'url': 'https://imgur.com/6xF7YKE.jpg'}, {'url': 'https://imgur.com/Q99e0Vb.jpg'}]",林智堅都是國民黨錯抹黑我我去聽了林智堅退選原因總結就是1我是清白我要捍衛自己2我坦然離開3國民黨造謠抹黑千錯萬錯都是別人錯🤪,"['林智堅', '都是', '國民黨', '錯', '抹', '黑', '我', '我', '去', '聽', '了', '林智堅', '退選', '原因', '總結', '就是', '1', '我', '是', '清白', '我', '要', '捍衛', '自己', '2', '我', '坦然', '離開', '3', '國民黨', '造謠', '抹', '黑千錯', '萬錯', '都是', '別人', '錯', '🤪']"
107,239684089,關於燒金紙拜拜,身為無神論的家庭，每年都不知道為什麼大家都會燒金紙，我大概就清明節掃墓才會摸到紙錢。但我一直有一個疑問，既然金紙都要燒才能送上去，那供品不是也要燒起來才對嗎？想像一下大家燒金紙的時候，在旁邊順便烤魚烤,255fd275-fec2-49d2-8e46-2e1557ffaeb0,,2022-08-12 09:31:35.616000+00:00,1,2,['拜拜'],閒聊,,[],關於燒金紙拜拜身為無神論家庭每年都不知道為什麼大家都會燒金紙我大概就清明節掃墓才會摸到紙錢但我一直有一個疑問既然金紙都要燒才能送上去那供品不是也要燒起來才對嗎想像一下大家燒金紙時候在旁邊順便烤魚烤,"['關於', '燒金紙', '拜', '拜', '身為', '無神論', '家庭', '每年', '都', '不知道', '為什麼', '大家', '都', '會', '燒金紙', '我', '大概', '就', '清明節', '掃墓', '才', '會', '摸', '到', '紙錢', '但', '我', '一直', '有', '一個', '疑問', '既然', '金紙', '都', '要燒', '才能', '送', '上去', '那', '供品', '不是', '也', '要', '燒起', '來', '才', '對', '嗎', '想像', '一下', '大家', '燒金紙', '時候', '在', '旁邊', '順便', '烤魚', '烤']"
108,239684081,沒品外送員：）,我真的第一次那麼不爽陌生人，剛大概17：00在東區的吐司利亞外的紅磚道，我跟男友後面有一台foodpanda 看他要過就推男友到旁邊騎樓讓他過，結果他騎過去髒水整個潑到我身上，我整個小毛頭T都是髒污，,255fd275-fec2-49d2-8e46-2e1557ffaeb0,,2022-08-12 09:31:14.062000+00:00,2,2,"['外送員', '沒水準', '海豚刑警', '小毛頭T']",閒聊,,[],沒品外送員我真第一次那麼不爽陌生人剛大概1700在東區吐司利亞外紅磚道我跟男友後面有一台foodpanda看他要過就推男友到旁邊騎樓讓他過結果他騎過去髒水整個潑到我身上我整個小毛頭T都是髒污,"['沒品', '外', '送員', '我', '真', '第', '一次', '那麼', '不爽', '陌生', '人剛', '大概', '1700', '在', '東區', '吐司', '利亞', '外紅磚', '道', '我', '跟', '男友', '後面', '有', '一台', 'foodpanda', '看', '他', '要過', '就', '推男友', '到', '旁邊', '騎樓', '讓他', '過結果', '他', '騎過', '去', '髒', '水', '整', '個', '潑', '到', '我', '身', '上', '我', '整', '個', '小毛頭', 'T', '都是', '髒', '污']"
109,239684058,女朋友是不是都喜歡擠另一半的痘痘……,🥶我的日本女友每天回家都要我躺在沙發上讓她擠痘痘，或者拔胸毛，或者清耳屎……，想詢問一下，這是她的特殊嗜好還是女生都喜歡這麼做？附上最近去FF14餐廳吃飯的照片,255fd275-fec2-49d2-8e46-2e1557ffaeb0,,2022-08-12 09:28:12.611000+00:00,3,1,"['女朋友', '另一半', '閒聊']",閒聊,,[{'url': 'https://imgur.com/h7CWQoI.jpg'}],女朋友是不是都喜歡擠另一半痘痘🥶我日本女友每天回家都要我躺在沙發上讓她擠痘痘或者拔胸毛或者清耳屎想詢問一下這是她特殊嗜好還是女生都喜歡這麼做附上最近去FF14餐廳吃飯照片,"['女朋友', '是', '不是', '都', '喜歡', '擠', '另一半', '痘', '痘', '🥶', '我', '日本', '女友', '每天', '回家', '都', '要', '我', '躺', '在', '沙發', '上', '讓', '她', '擠', '痘', '痘', '或者', '拔', '胸毛', '或者', '清耳屎', '想', '詢問', '一下', '這是', '她', '特殊', '嗜好', '還是', '女生', '都', '喜歡', '這麼', '做', '附上', '最近', '去', 'FF14', '餐廳', '吃飯', '照片']"
110,239684052,lalamove媒合不到司機,近期要搬家要預約lalamove，但一直配對不到，想問有人有遇過這種情況嗎,255fd275-fec2-49d2-8e46-2e1557ffaeb0,,2022-08-12 09:27:20.584000+00:00,2,2,['lalamove'],閒聊,,[],lalamove媒合不到司機近期要搬家要預約lalamove但一直配對不到想問有人有遇過這種情況嗎,"['lalamove', '媒合', '不到', '司機', '近期', '要', '搬家要', '預約', 'lalamove', '但', '一直', '配對', '不到', '想', '問有', '人', '有', '遇過', '這種', '情況', '嗎']"
111,239684024,去柬埔寨 割舌頭＋付30萬贖金仍回不來。,台人赴柬埔寨打工遭詐騙的狀況頻傳，一名網友表示，身邊有一位朋友被自己信任的人騙去柬埔寨工作，遭受被割舌頭的虐待後，家人為了保護他，立刻繳了30萬的贖金，結果對方收到錢以後也沒放人，而他的這位朋友至今已,255fd275-fec2-49d2-8e46-2e1557ffaeb0,,2022-08-12 09:23:01.820000+00:00,119,834,"['柬埔寨', '東南亞', '工作', '詐騙']",閒聊,,[],去柬埔寨割舌頭付30萬贖金仍回不來台人赴柬埔寨打工遭詐騙狀況頻傳一名網友表示身邊有一位朋友被自己信任人騙去柬埔寨工作遭受被割舌頭虐待後家人為了保護他立刻繳了30萬贖金結果對方收到錢以後也沒放人而他這位朋友至今已,"['去', '柬埔寨', '割舌頭付', '30', '萬贖金', '仍', '回不來', '台人', '赴', '柬埔寨', '打工', '遭詐', '騙', '狀況', '頻傳', '一名', '網友表示', '身邊', '有', '一位', '朋友', '被', '自己', '信任', '人騙', '去', '柬埔寨', '工作', '遭受', '被', '割舌頭', '虐待', '後', '家人', '為', '了', '保護', '他立', '刻繳', '了', '30', '萬贖金', '結果', '對方', '收到', '錢', '以後', '也', '沒放人', '而', '他', '這位', '朋友', '至', '今', '已']"
112,239684020,英文底標上東吳國貿的勵志故事,我剛剛，被我分科的朋友嘴說，你看，我分科上東吳 你們在那邊做一堆備審還沒有考分科實在，我國文均標英文底標數b後標上東吳國貿耶！，阿你輔大商科哦，低我們一等 東吳商比較厲害，謝謝，我祝福妳在東吳被電爛，,255fd275-fec2-49d2-8e46-2e1557ffaeb0,,2022-08-12 09:22:47.482000+00:00,8,9,"['底標', '做愛', '喝酒', 'Tinder', '夜夜笙歌']",閒聊,,[],英文底標上東吳國貿勵志故事我剛剛被我分科朋友嘴說你看我分科上東吳你們在那邊做一堆備審還沒有考分科實在我國文均標英文底標數b後標上東吳國貿耶阿你輔大商科哦低我們一等東吳商比較厲害謝謝我祝福妳在東吳被電爛,"['英文底標', '上東', '吳', '國貿', '勵志', '故事', '我', '剛剛', '被', '我', '分科', '朋友', '嘴', '說', '你', '看', '我', '分科', '上東', '吳', '你們', '在', '那邊', '做', '一堆', '備審還', '沒有', '考', '分科', '實在', '我', '國文', '均標', '英文底', '標數', 'b', '後', '標', '上東', '吳', '國貿', '耶', '阿', '你', '輔大', '商科', '哦', '低', '我們', '一等', '東', '吳商', '比', '較', '厲害', '謝謝', '我', '祝福', '妳在', '東吳', '被', '電爛']"
113,239684013,有人有推薦洗澡的嗎或著洗頭的,有染過頭髮，洗澡的味道香就好了，有人有推薦嗎,255fd275-fec2-49d2-8e46-2e1557ffaeb0,,2022-08-12 09:22:04.124000+00:00,0,0,[],閒聊,,[],有人有推薦洗澡嗎或著洗頭有染過頭髮洗澡味道香就好了有人有推薦嗎,"['有', '人', '有', '推薦', '洗澡', '嗎', '或', '著', '洗頭', '有染', '過頭', '髮', '洗澡', '味道', '香', '就', '好', '了', '有', '人', '有', '推薦', '嗎']"
114,239683976,不喜勿X真的很萬用,每次FB社團都會有人加上#不喜勿噴，第一你自己都覺得會被噴那你還發ㄙㄢㄒㄧㄠ？第二發了就要有被噴的準備好嗎小朋友，然後我還發現有人說他兩句他就會回「不喜勿噴看不懂嗎」這類的淦話，好哦那這樣的話我在這邊,255fd275-fec2-49d2-8e46-2e1557ffaeb0,,2022-08-12 09:17:59.557000+00:00,3,0,['屁孩'],閒聊,,[],不喜勿X真很萬用每次FB社團都會有人加上不喜勿噴第一你自己都覺得會被噴那你還發ㄙㄢㄒㄧㄠ第二發了就要有被噴準備好嗎小朋友然後我還發現有人說他兩句他就會回不喜勿噴看不懂嗎這類淦話好哦那這樣話我在這邊,"['不喜', '勿', 'X', '真', '很', '萬用', '每次', 'FB', '社團', '都', '會', '有', '人', '加上', '不喜', '勿', '噴第一', '你', '自己', '都', '覺得', '會', '被', '噴那', '你', '還發', 'ㄙ', 'ㄢ', 'ㄒ', 'ㄧ', 'ㄠ', '第', '二發', '了', '就要', '有', '被', '噴準備', '好', '嗎', '小朋友', '然後', '我', '還發現', '有', '人', '說', '他', '兩句', '他', '就', '會', '回不喜', '勿', '噴看', '不', '懂嗎', '這類', '淦', '話', '好', '哦', '那', '這樣', '話', '我', '在', '這邊']"
115,239683945,#分享 賭你不認識的冷門畫師推薦,最近回歸Twitter發現一位風格獨特的畫師～月球牡蠣，雖然follower只有兩千多人，但畫風蠻特別的，暗色調的作品很有吸引力。他的作品都是以藍綠色和黑白上色，作品中表達了許多心境上的憂鬱。雖然顏色,255fd275-fec2-49d2-8e46-2e1557ffaeb0,,2022-08-12 09:14:16.548000+00:00,0,1,"['分享', '畫師推薦', '插畫']",閒聊,,"[{'url': 'https://imgur.com/M5MQQrC.jpg'}, {'url': 'https://imgur.com/HU2DTtW.jpg'}, {'url': 'https://imgur.com/ZG97a7O.jpg'}]",分享賭你不認識冷門畫師推薦最近回歸Twitter發現一位風格獨特畫師月球牡蠣雖然follower只有兩千多人但畫風蠻特別暗色調作品很有吸引力他作品都是以藍綠色和黑白上色作品中表達了許多心境上憂鬱雖然顏色,"['分享', '賭', '你', '不', '認識', '冷門', '畫師', '推薦', '最近', '回歸', 'Twitter', '發現', '一位', '風格', '獨特畫', '師月球', '牡蠣', '雖然', 'follower', '只有', '兩千多', '人', '但', '畫風蠻', '特別', '暗色調', '作品', '很', '有', '吸引力', '他', '作品', '都是', '以', '藍綠色', '和', '黑白', '上色', '作品', '中表', '達', '了', '許多', '心境', '上', '憂鬱', '雖然', '顏色']"
116,239683900,柬埔寨相關報導整理,給想關注的人 都是網路上能找到的東西，馬華日落洞區會，裡面有園區流出的影片，看了真的是會對人性感到失望……，中國的受害者也非常多，好像是因為這個政策，讓園區的這些中國基層詐騙人口大量流失，所以目標慢慢,255fd275-fec2-49d2-8e46-2e1557ffaeb0,239675764.0,2022-08-12 09:06:22.615000+00:00,15,81,"['柬埔寨', '詐騙', '柬埔寨詐騙', '柬埔寨詐騙園區']",閒聊,去柬埔寨的女生好慘,[],柬埔寨相關報導整理給想關注人都是網路上能找到東西馬華日落洞區會裡面有園區流出影片看了真是會對人性感到失望中國受害者也非常多好像是因為這個政策讓園區這些中國基層詐騙人口大量流失所以目標慢慢,"['柬埔寨', '相關', '報導', '整理給', '想關', '注人', '都是', '網', '路上', '能', '找', '到', '東西馬華', '日落', '洞區', '會裡面', '有', '園區', '流出', '影片', '看', '了', '真', '是', '會', '對', '人性', '感到', '失望', '中國', '受害者', '也', '非常多', '好', '像是', '因為', '這個', '政策', '讓', '園區', '這些', '中國', '基層', '詐騙', '人口', '大量', '流失', '所以', '目標', '慢慢']"
117,239683876,林智堅只有抄40%，不能撤銷學位，應該算0.5個碩士。,林智堅只有抄襲40%啊。代表至少有60%是原創的。菜EE都能拿1.5個博士了，林智堅不應該被整個撤銷，應該要保留0.5個碩士。年底要用選票來證明林智堅的論文有沒有抄襲。只要民進黨選贏，代表人民支持林沒,255fd275-fec2-49d2-8e46-2e1557ffaeb0,,2022-08-12 09:03:27.183000+00:00,10,18,['閒聊'],閒聊,,[],林智堅只有抄40不能撤銷學位應該算05個碩士林智堅只有抄襲40啊代表至少有60是原創菜EE都能拿15個博士了林智堅不應該被整個撤銷應該要保留05個碩士年底要用選票來證明林智堅論文有沒有抄襲只要民進黨選贏代表人民支持林沒,"['林智堅', '只有', '抄', '40', '不能', '撤銷', '學位', '應該', '算', '05', '個', '碩', '士林', '智堅', '只有', '抄襲', '40', '啊', '代表', '至', '少有', '60', '是', '原創', '菜', 'EE', '都', '能', '拿', '15', '個', '博士', '了', '林智堅', '不', '應該', '被', '整個', '撤銷', '應該', '要', '保留', '05', '個', '碩士', '年底', '要用', '選票', '來證', '明林智', '堅論', '文有', '沒有', '抄襲', '只要', '民進', '黨', '選贏', '代表', '人民', '支持林', '沒']"
119,239683857,大家是怎麼拓展交友圈的 #朋友,今年要升大一，在暑假期間覺得朋友有點少，想要有可以一起出去玩 旅行的，除了交友軟體以外，另外，大家這個暑假都在幹嘛呢？,255fd275-fec2-49d2-8e46-2e1557ffaeb0,,2022-08-12 09:01:53.471000+00:00,0,0,"['朋友', '交友圈', '閒聊', '心情', '心事']",閒聊,,[],大家是怎麼拓展交友圈朋友今年要升大一在暑假期間覺得朋友有點少想要有可以一起出去玩旅行除了交友軟體以外另外大家這個暑假都在幹嘛呢,"['大家', '是', '怎麼', '拓展', '交友', '圈朋友', '今年', '要', '升大一', '在', '暑', '假期', '間', '覺得', '朋友', '有', '點少', '想要', '有', '可以', '一起', '出去玩', '旅行', '除了', '交友', '軟體', '以外', '另外', '大家', '這個', '暑假', '都', '在', '幹嘛', '呢']"
120,239683844,這真的有D？！,這跟我認知的D是不是不太一樣啊，頂多大A小b，還是是她太瘦？紅格子那套的左邊線條也怪怪的。,255fd275-fec2-49d2-8e46-2e1557ffaeb0,,2022-08-12 08:59:50.902000+00:00,400,825,"['網美', '比基尼', '女生']",閒聊,,"[{'url': 'https://imgur.com/WDQzmKl.jpg'}, {'url': 'https://imgur.com/DCbWxHk.jpg'}, {'url': 'https://imgur.com/gAF0raB.jpg'}]",這真有D這跟我認知D是不是不太一樣啊頂多大A小b還是是她太瘦紅格子那套左邊線條也怪怪,"['這真', '有', 'D', '這跟', '我', '認知', 'D', '是', '不是', '不太', '一樣', '啊', '頂', '多', '大', 'A', '小', 'b', '還是', '是', '她', '太', '瘦', '紅格子', '那套', '左邊', '線條', '也', '怪怪']"
121,239683837,8/8我確診了,8/7開始喉嚨痛立馬快篩是陰性，8/8早上起床喉嚨痛爆就知道完蛋了，馬上快篩果不其然是陽性🥲，前三天喉嚨痛到完全很難吃東西下去，只能靠喝的東西，我就拿著手電筒照我的喉嚨，扁條線發炎喉嚨發炎，扁條線那邊,255fd275-fec2-49d2-8e46-2e1557ffaeb0,,2022-08-12 08:58:33.081000+00:00,8,3,['確診'],閒聊,,[],88我確診了87開始喉嚨痛立馬快篩是陰性88早上起床喉嚨痛爆就知道完蛋了馬上快篩果不其然是陽性🥲前三天喉嚨痛到完全很難吃東西下去只能靠喝東西我就拿著手電筒照我喉嚨扁條線發炎喉嚨發炎扁條線那邊,"['88', '我', '確診', '了', '87', '開始', '喉嚨痛', '立馬', '快篩', '是', '陰性', '88', '早', '上起', '床', '喉嚨痛', '爆', '就', '知道', '完蛋', '了', '馬', '上', '快篩', '果不其然', '是', '陽性', '\U0001f972', '前三天', '喉嚨痛', '到', '完全', '很難', '吃', '東西', '下去', '只能靠', '喝東西', '我', '就', '拿', '著', '手電筒', '照', '我', '喉嚨', '扁條線', '發炎', '喉嚨', '發炎', '扁', '條線', '那邊']"
122,239683828,#問 在香港如何證明有繼承權？,最近工作上遇到受益人為香港人，但是這個受益人已經死亡，在臺灣有戶籍謄本可以載明受益人和其繼承人關係，那在香港有類似的證明文書嗎？,255fd275-fec2-49d2-8e46-2e1557ffaeb0,,2022-08-12 08:56:52.806000+00:00,0,0,"['問', '香港', '繼承']",閒聊,,[],問在香港如何證明有繼承權最近工作上遇到受益人為香港人但是這個受益人已經死亡在臺灣有戶籍謄本可以載明受益人和其繼承人關係那在香港有類似證明文書嗎,"['問在', '香港', '如何', '證明', '有', '繼承權', '最近', '工作', '上遇', '到', '受益人', '為', '香港', '人', '但是', '這個', '受益人', '已經', '死亡', '在', '臺', '灣有', '戶籍謄本', '可以', '載明', '受益人', '和', '其', '繼承人', '關係', '那', '在', '香港', '有類', '似證', '明文書', '嗎']"
123,239683805,某林退選,三軍統帥 在幾天前力挺某林，結果最後查驗出來 ㄏㄏ笑死，好啦回歸正題 蔡英文 會給某林什麼職位ㄚ 畢竟之前沒選上的有的去當交通部長 行政院副院長 所以所以好期待某林之後會去做什麼職位喔,255fd275-fec2-49d2-8e46-2e1557ffaeb0,,2022-08-12 08:53:59.257000+00:00,2,0,[],閒聊,,[],某林退選三軍統帥在幾天前力挺某林結果最後查驗出來ㄏㄏ笑死好啦回歸正題蔡英文會給某林什麼職位ㄚ畢竟之前沒選上有去當交通部長行政院副院長所以所以好期待某林之後會去做什麼職位喔,"['某林', '退選', '三軍', '統帥', '在', '幾天', '前力', '挺', '某林', '結果', '最後查驗', '出來', 'ㄏ', 'ㄏ', '笑', '死', '好', '啦', '回歸', '正題', '蔡英', '文會給', '某林', '什麼', '職位', 'ㄚ', '畢竟', '之前', '沒選', '上有', '去當', '交通部長', '行政院', '副', '院長', '所以', '所以', '好期', '待', '某林', '之', '後會', '去', '做', '什麼', '職位', '喔']"
124,239683798,柬埔寨社群討論,想請問也有人加入這個社團嗎？,255fd275-fec2-49d2-8e46-2e1557ffaeb0,,2022-08-12 08:53:15.470000+00:00,0,0,"['柬埔寨', '社群']",閒聊,,[{'url': 'https://imgur.com/XdvXf08.jpg'}],柬埔寨社群討論想請問也有人加入這個社團嗎,"['柬埔寨', '社群', '討論', '想', '請問', '也', '有', '人', '加入', '這個', '社團', '嗎']"
125,239683765,原來藏壽司的盤子可以滑回去！,「您的餐點即將抵達，您的餐點即將抵達」我抬頭看到一個空盤子滑過來，往內場看去，看到霜淇淋沒有坐上去XD，後來空盤子被吸回去，這次霜淇淋真的來了，吃這麼多遍第一次遇到，好好玩！,255fd275-fec2-49d2-8e46-2e1557ffaeb0,,2022-08-12 08:48:23.810000+00:00,46,2153,"['壽司', '盤子']",閒聊,,"[{'url': 'https://imgur.com/81oyA70.jpg'}, {'url': 'https://imgur.com/zsFVlS8.jpg'}, {'url': 'https://imgur.com/V6CesSf.jpg'}]",原來藏壽司盤子可以滑回去您餐點即將抵達您餐點即將抵達我抬頭看到一個空盤子滑過來往內場看去看到霜淇淋沒有坐上去XD後來空盤子被吸回去這次霜淇淋真來了吃這麼多遍第一次遇到好好玩,"['原來', '藏', '壽司', '盤子', '可以', '滑', '回去', '您', '餐點', '即將', '抵達', '您', '餐點', '即將', '抵達', '我', '抬頭', '看', '到', '一個', '空盤子', '滑過', '來往', '內場', '看去', '看', '到', '霜', '淇', '淋', '沒有', '坐上去', 'XD', '後來', '空盤子', '被', '吸回去', '這次', '霜', '淇', '淋真來', '了', '吃', '這麼', '多遍', '第', '一次', '遇到', '好', '好玩']"
126,239683742,女生都喜歡白白的男生嗎,如題，昨天在ptt上看到討論，想問dcard的女生們真的比較喜歡白白的男生嗎，小時候我覺得曬成古銅色的男生很帥，不過近年來覺得好像都是白白的男藝人比較受歡迎的感覺...，如圖，許光漢，宋江，朴寶劍，韋,255fd275-fec2-49d2-8e46-2e1557ffaeb0,,2022-08-12 08:44:10.197000+00:00,14,6,"['女生', '喜歡', '男生', '閒聊', '感情']",閒聊,,"[{'url': 'https://imgur.com/clv6Qxf.jpg'}, {'url': 'https://imgur.com/0zwg8AT.jpg'}, {'url': 'https://imgur.com/7Ib1fpE.jpg'}, {'url': 'https://imgur.com/6KBZ2Io.jpg'}, {'url': 'https://imgur.com/DnuRU1E.jpg'}]",女生都喜歡白白男生嗎如題昨天在ptt上看到討論想問dcard女生們真比較喜歡白白男生嗎小時候我覺得曬成古銅色男生很帥不過近年來覺得好像都是白白男藝人比較受歡迎感覺如圖許光漢宋江朴寶劍韋,"['女生', '都', '喜歡', '白白', '男生', '嗎', '如題', '昨天', '在', 'ptt', '上', '看', '到', '討論', '想問', 'dcard', '女生', '們', '真', '比', '較', '喜歡', '白白', '男生', '嗎', '小時候', '我', '覺得', '曬成', '古銅色', '男生', '很帥', '不過', '近', '年來', '覺得', '好像', '都是', '白白', '男藝人', '比', '較', '受歡迎', '感覺', '如圖', '許光漢', '宋江', '朴', '寶劍', '韋']"
127,239683724,關於 保 保險🥺,想問大家幾歲開始保保險或者覺得是否需要保保險，即將21的我 很猶豫是否有必要幫自己保保險？,255fd275-fec2-49d2-8e46-2e1557ffaeb0,,2022-08-12 08:42:03.578000+00:00,3,0,"['保險', '閒聊', '生活']",閒聊,,[],關於保保險🥺想問大家幾歲開始保保險或者覺得是否需要保保險即將21我很猶豫是否有必要幫自己保保險,"['關於', '保', '保險', '🥺', '想問', '大家', '幾歲', '開始', '保', '保險', '或者', '覺得', '是否', '需要', '保', '保險', '即將', '21', '我', '很', '猶豫', '是', '否有', '必要', '幫自己', '保', '保險']"
