53,239685507,月老板開板求助,有非常多月老的相關故事與內容，希望可以把那些有趣的故事整理成一個板，像是自己成為月老的故事，你跟月老間的愛恨情仇，怎麼跟月老盧到另一半的好方法，或是沒有適合的對象想徵對象，都請支持月老板的成立。內文更,255fd275-fec2-49d2-8e46-2e1557ffaeb0,239685344.0,2022-08-12 12:32:51.362000+00:00,0,0,"['月老', '開板', '求助', '感情', '有趣']",閒聊,#開板連署 月老板開板連署,[],月老板開板求助有非常多月老相關故事與內容希望可以把那些有趣故事整理成一個板像是自己成為月老故事你跟月老間愛恨情仇怎麼跟月老盧到另一半好方法或是沒有適合對象想徵對象都請支持月老板成立內文更,"['月老', '板', '開板', '求助', '有', '非常多', '月老', '相關', '故事', '與', '內容', '希望', '可以', '把', '那些', '有趣', '故事', '整理成', '一個', '板', '像是', '自己', '成為', '月老', '故事', '你', '跟', '月老', '間', '愛恨', '情仇', '怎麼', '跟', '月老', '盧到', '另一半', '好方法', '或是', '沒有', '適合', '對象', '想徵', '對象', '都', '請', '支持', '月老', '板', '成立', '內文', '更']"
54,239685449,有人知道這個正妹是哪位明星或藝人嗎？,看起來是新秘彩妝的ig，但是裡面沒有tag這位model，內文和留言也都是泰文看不懂，真的很想知道她是誰,255fd275-fec2-49d2-8e46-2e1557ffaeb0,,2022-08-12 12:26:09.458000+00:00,5,24,"['正妹', '閒聊', 'ig', '請益']",閒聊,,[{'url': 'https://vivid.dcard.tw/Public/0593b5e1-e699-4bd4-ae8a-7ba37bea60e9/thumbnail.jpg'}],有人知道這個正妹是哪位明星或藝人嗎看起來是新秘彩妝ig但是裡面沒有tag這位model內文和留言也都是泰文看不懂真很想知道她是誰,"['有人', '知道', '這個', '正妹', '是', '哪位', '明星', '或', '藝人', '嗎', '看', '起來', '是', '新秘', '彩妝', 'ig', '但是', '裡面', '沒有', 'tag', '這位', 'model', '內文', '和', '留言', '也', '都是', '泰文', '看', '不', '懂', '真', '很', '想', '知道', '她', '是', '誰']"
55,239685399,走了一個抄襲的 來了一個挺抄襲的,我是覺得照民進黨今天記者會的定調，鄭運鵬等於相信智堅，真的能夠那麼輕鬆的切割乾淨嗎？換成鄭運鵬就不會被問是不是相信智堅？是不是對幹台大？這些問題嗎，下禮拜還有中華大學要開獎呢,255fd275-fec2-49d2-8e46-2e1557ffaeb0,,2022-08-12 12:21:24.194000+00:00,3,25,"['抄襲', '閒聊', '時事', '林智堅', '民進黨']",閒聊,,[{'url': 'https://imgur.com/gA1ukLb.jpg'}],走了一個抄襲來了一個挺抄襲我是覺得照民進黨今天記者會定調鄭運鵬等於相信智堅真能夠那麼輕鬆切割乾淨嗎換成鄭運鵬就不會被問是不是相信智堅是不是對幹台大這些問題嗎下禮拜還有中華大學要開獎呢,"['走', '了', '一個', '抄襲', '來', '了', '一個', '挺', '抄襲', '我', '是', '覺得', '照民進', '黨', '今天', '記者', '會', '定調', '鄭運鵬', '等', '於', '相信智', '堅真', '能夠', '那麼', '輕', '鬆', '切割', '乾淨', '嗎', '換成', '鄭運鵬', '就', '不會', '被', '問是', '不是', '相信智', '堅是', '不是', '對', '幹', '台大', '這些', '問題', '嗎', '下禮拜', '還有', '中華', '大學', '要', '開獎', '呢']"
56,239685373,高雄夜店,8/20和21晚上在考慮要不要去夜店，但目前只有我自己一個人，如果我決定要去的話有人要一起去ㄇ，希望可以找到女生一起如果沒有女生的話男生也可以考慮看看哈哈哈，不過我還在考慮哦 不是一定會去！,255fd275-fec2-49d2-8e46-2e1557ffaeb0,,2022-08-12 12:19:21.375000+00:00,6,1,"['高雄', '夜店', '閒聊', '女生', '男生']",閒聊,,[],高雄夜店820和21晚上在考慮要不要去夜店但目前只有我自己一個人如果我決定要去話有人要一起去ㄇ希望可以找到女生一起如果沒有女生話男生也可以考慮看看哈哈哈不過我還在考慮哦不是一定會去,"['高雄', '夜店', '820', '和', '21', '晚上', '在', '考慮', '要', '不要', '去', '夜店', '但', '目前', '只有', '我', '自己', '一個人', '如果', '我決', '定要', '去', '話', '有', '人', '要', '一起', '去', 'ㄇ', '希望', '可以', '找到', '女生', '一起', '如果', '沒有', '女生', '話', '男生', '也', '可以', '考慮', '看', '看', '哈哈哈', '不過', '我', '還在', '考慮', '哦', '不是', '一', '定會', '去']"
57,239685353,現在有什麼好玩的手遊嗎,我只有打傳說斷斷續續加起來也有玩兩年多了最近覺得很無聊想問各位有什麼推薦的，我個人比較偏好可以跟其他人一起玩的遊戲～不能接受3d遊戲像是吃雞玩了會頭暈而且我永遠沒看到敵人就成盒^_^，摩爾還有之前很紅,255fd275-fec2-49d2-8e46-2e1557ffaeb0,,2022-08-12 12:16:41.993000+00:00,4,0,['手遊'],閒聊,,[],現在有什麼好玩手遊嗎我只有打傳說斷斷續續加起來也有玩兩年多了最近覺得很無聊想問各位有什麼推薦我個人比較偏好可以跟其他人一起玩遊戲不能接受3d遊戲像是吃雞玩了會頭暈而且我永遠沒看到敵人就成盒_摩爾還有之前很紅,"['現在', '有', '什麼', '好玩', '手遊', '嗎', '我', '只有', '打', '傳說', '斷斷', '續續', '加起', '來', '也', '有', '玩', '兩年', '多', '了', '最近', '覺得', '很無聊', '想問', '各位', '有', '什麼', '推薦', '我', '個人', '比較', '偏好', '可以', '跟', '其他人', '一起', '玩遊戲', '不能', '接受', '3d', '遊戲', '像是', '吃', '雞', '玩', '了', '會頭', '暈而且', '我永遠', '沒', '看', '到', '敵人', '就', '成盒', '_', '摩爾', '還有', '之前', '很紅']"
58,239685328,終於明白在藏壽司為什麼不要拿迴轉盤上的東西,今天吃藏壽司的時候往後面一看，看到了一個令我驚訝的事情...，終於懂為什麼很多人都說不太會去拿迴轉盤上面的壽司了~，事情是這樣子的，今天跟朋友聊的很開心，不經意的往後面看了一下，我看到一隻手和一個鼻子,255fd275-fec2-49d2-8e46-2e1557ffaeb0,,2022-08-12 12:13:54.781000+00:00,120,1460,"['壽司', '閒聊', '藏壽司', '傻眼']",閒聊,,[],終於明白在藏壽司為什麼不要拿迴轉盤上東西今天吃藏壽司時候往後面一看看到了一個令我驚訝事情終於懂為什麼很多人都說不太會去拿迴轉盤上面壽司了事情是這樣子今天跟朋友聊很開心不經意往後面看了一下我看到一隻手和一個鼻子,"['終於明', '白', '在', '藏', '壽司', '為什麼', '不要', '拿', '迴', '轉盤', '上東', '西', '今天', '吃', '藏', '壽司', '時候', '往後面', '一看', '看', '到', '了', '一個', '令', '我', '驚訝', '事情', '終於懂', '為什麼', '很多', '人', '都', '說', '不太會', '去', '拿', '迴', '轉盤', '上面', '壽司', '了', '事情', '是', '這樣子', '今天', '跟', '朋友', '聊', '很', '開心', '不經意', '往後面', '看', '了', '一下', '我', '看', '到', '一隻', '手', '和', '一個', '鼻子']"
59,239685319,慎入！這是真的嗎,網址是最近流出的摘器官影片，看到當下真的好震驚…,255fd275-fec2-49d2-8e46-2e1557ffaeb0,,2022-08-12 12:12:49.299000+00:00,5,0,"['時事', '詐騙', '閒聊', '傻眼']",閒聊,,[],慎入這是真嗎網址是最近流出摘器官影片看到當下真好震驚,"['慎入', '這是', '真', '嗎', '網址', '是', '最近', '流出', '摘', '器官', '影片', '看到', '當下', '真', '好', '震', '驚']"
60,239685306,腳一定要放那樣嗎…,吃個飯旁邊人腳放這樣根本影響吃飯心情，旁邊袋子裡有看到檳榔，店員都女生感覺也不敢管，太噁了,255fd275-fec2-49d2-8e46-2e1557ffaeb0,,2022-08-12 12:11:00.282000+00:00,30,94,"['腳', '閒聊', '傻眼']",閒聊,,"[{'url': 'https://imgur.com/8njzWvr.jpg'}, {'url': 'https://imgur.com/AiC1Jc5.jpg'}]",腳一定要放那樣嗎吃個飯旁邊人腳放這樣根本影響吃飯心情旁邊袋子裡有看到檳榔店員都女生感覺也不敢管太噁了,"['腳', '一定要', '放', '那樣', '嗎', '吃', '個', '飯', '旁邊', '人', '腳放', '這樣', '根本', '影響', '吃飯', '心情', '旁邊', '袋子裡', '有', '看', '到', '檳榔', '店員', '都', '女生', '感覺', '也', '不敢', '管太', '噁', '了']"
61,239685283,統編怎麼唸？,這幾天板上好多人討論電話號碼跟身分證字號的唸法，於是突然想到⋯⋯⋯，在公司常常聽到同事對於統編的唸法是：1. XXXX-XXXX，例如：1234-7978，我自己則是覺得：2. XXX-XXXXX，例,255fd275-fec2-49d2-8e46-2e1557ffaeb0,,2022-08-12 12:09:19.680000+00:00,8,1,"['閒聊', '統編', '生活']",閒聊,,[],統編怎麼唸這幾天板上好多人討論電話號碼跟身分證字號唸法於是突然想到⋯⋯⋯在公司常常聽到同事對於統編唸法是1XXXXXXXX例如12347978我自己則是覺得2XXXXXXXX例,"['統編', '怎麼', '唸', '這', '幾天', '板上', '好多', '人討論', '電話', '號碼', '跟', '身分證', '字號', '唸法', '於是', '突然', '想到', '⋯', '⋯', '⋯', '在', '公司', '常', '常聽到', '同事', '對於', '統編', '唸法', '是', '1XXXXXXXX', '例如', '12347978', '我', '自己則', '是', '覺得', '2XXXXXXXX', '例']"
62,239685277,柬埔寨 白沙集團 (圖片回答) 全面入侵低卡,盜網路照片被抓包，台大帳號說跑去那工作，再加上多人帳號回話8+9口氣，陸續有人說在那工作還回來，等等看完以下照片 有頭腦的完全了解怎一回事了，請在臉書搜尋 白沙 柬埔寨，全都是假帳號再發這間公司的徵才,255fd275-fec2-49d2-8e46-2e1557ffaeb0,,2022-08-12 12:08:38.704000+00:00,5,27,"['柬埔寨', '時事', '工作', '詐騙']",閒聊,,"[{'url': 'https://imgur.com/56tOWDa.jpg'}, {'url': 'https://imgur.com/pkGVMhN.jpg'}, {'url': 'https://imgur.com/7joN3jq.jpg'}]",柬埔寨白沙集團圖片回答全面入侵低卡盜網路照片被抓包台大帳號說跑去那工作再加上多人帳號回話89口氣陸續有人說在那工作還回來等等看完以下照片有頭腦完全了解怎一回事了請在臉書搜尋白沙柬埔寨全都是假帳號再發這間公司徵才,"['柬埔寨', '白沙', '集團', '圖片', '回答', '全面', '入侵', '低卡盜', '網路', '照片', '被', '抓', '包', '台大', '帳號', '說', '跑', '去', '那', '工作', '再', '加上', '多人', '帳號', '回話', '89', '口氣', '陸續', '有', '人', '說', '在', '那', '工作', '還', '回來', '等', '等', '看', '完', '以下', '照片', '有', '頭腦', '完全', '了解', '怎一', '回事', '了', '請', '在', '臉書', '搜尋白沙', '柬埔寨', '全', '都是', '假', '帳號', '再發', '這間', '公司', '徵才']"
63,239685271,說走就走的旅行,有人有說走就走的旅行經歷嗎，拋下一切去做自己想做的事。,255fd275-fec2-49d2-8e46-2e1557ffaeb0,,2022-08-12 12:08:15.931000+00:00,1,2,"['旅行', '閒聊', '生活']",閒聊,,[],說走就走旅行有人有說走就走旅行經歷嗎拋下一切去做自己想做事,"['說', '走', '就', '走', '旅行', '有', '人', '有', '說', '走', '就', '走', '旅行', '經歷', '嗎', '拋下', '一切', '去', '做', '自己', '想', '做事']"
64,239685177,什麼是目前最快的賺錢方式？,看了最近那麼多詐騙新聞，最好賺的都寫在刑法裡（？撇除掉違法的，有什麼工作是目前最好賺的嗎？舉例來講：今年初的三個月是NFT最好賺的時段，媽的隨便推項目大家都亂買，現在時機過了，項目方就不好賺了。還有什,255fd275-fec2-49d2-8e46-2e1557ffaeb0,,2022-08-12 11:57:48.503000+00:00,3,1,"['賺錢', '閒聊', '生活']",閒聊,,[],什麼是目前最快賺錢方式看了最近那麼多詐騙新聞最好賺都寫在刑法裡撇除掉違法有什麼工作是目前最好賺嗎舉例來講今年初三個月是NFT最好賺時段媽隨便推項目大家都亂買現在時機過了項目方就不好賺了還有什,"['什麼', '是', '目前', '最快', '賺', '錢', '方式', '看', '了', '最近', '那麼', '多詐', '騙', '新聞', '最', '好賺', '都', '寫', '在', '刑法', '裡撇除', '掉', '違法', '有', '什麼', '工作', '是', '目前', '最', '好賺', '嗎', '舉例', '來講', '今年初', '三個', '月', '是', 'NFT', '最', '好賺', '時段媽', '隨便', '推項', '目', '大家', '都', '亂', '買', '現在', '時機過', '了', '項', '目方', '就', '不', '好賺', '了', '還有', '什']"
65,239685156,皮膚好的男生or會穿搭的男生,如果一個是皮膚不錯但穿搭很普通，另一個是穿搭好看但是皮膚坑坑疤疤，作為女生，你們會比較注重穿搭還是乾淨的長相呢？,255fd275-fec2-49d2-8e46-2e1557ffaeb0,,2022-08-12 11:55:51.212000+00:00,4,1,"['皮膚', '男生', '女生', '閒聊']",閒聊,,[],皮膚好男生or會穿搭男生如果一個是皮膚不錯但穿搭很普通另一個是穿搭好看但是皮膚坑坑疤疤作為女生你們會比較注重穿搭還是乾淨長相呢,"['皮膚', '好', '男生', 'or', '會', '穿', '搭', '男生', '如果', '一個', '是', '皮膚', '不錯', '但', '穿', '搭', '很', '普通', '另', '一個', '是', '穿', '搭', '好看', '但是', '皮膚', '坑坑', '疤疤', '作為', '女生', '你們', '會', '比', '較', '注重', '穿', '搭', '還是', '乾淨', '長', '相', '呢']"
66,239685068,有聽過緒方一神齋嗎？,他有個外號叫拳聖，如何形容他？,255fd275-fec2-49d2-8e46-2e1557ffaeb0,,2022-08-12 11:45:07.222000+00:00,1,1,['閒聊'],閒聊,,[],有聽過緒方一神齋嗎他有個外號叫拳聖如何形容他,"['有', '聽', '過緒方', '一神齋', '嗎', '他', '有', '個', '外號', '叫', '拳', '聖', '如何', '形容', '他']"
67,239684997,台中西屯區、西區推薦釣蝦場,小弟最近剛上台中 想要釣蝦可是google評論看半天都不知道到底哪一間比較好 希望有經驗的大大能給個建議,255fd275-fec2-49d2-8e46-2e1557ffaeb0,,2022-08-12 11:34:25.293000+00:00,1,0,"['台中', '西屯區', '西區', '釣蝦', '釣蝦場']",閒聊,,[],台中西屯區西區推薦釣蝦場小弟最近剛上台中想要釣蝦可是google評論看半天都不知道到底哪一間比較好希望有經驗大大能給個建議,"['台', '中西', '屯區', '西區', '推薦', '釣', '蝦場', '小弟', '最近剛', '上台', '中', '想要', '釣蝦', '可是', 'google', '評論', '看半', '天都', '不知道', '到底', '哪', '一間', '比較', '好', '希望', '有', '經驗', '大大', '能給', '個', '建議']"
68,239684991,化妝前後差異太大,上大學和出社會後大部分女生應該都會化妝，絕大部分的人化妝應該都是為了讓外表更好看，雖然不是說化妝不好，但我很好奇那些因為化妝後的外表吸引到異性，而且化妝前後差異很大的女生們，難道不會擔心卸妝後男生會覺,255fd275-fec2-49d2-8e46-2e1557ffaeb0,,2022-08-12 11:33:39.985000+00:00,3,1,"['化妝', '感情', '女生', '閒聊']",閒聊,,[],化妝前後差異太大上大學和出社會後大部分女生應該都會化妝絕大部分人化妝應該都是為了讓外表更好看雖然不是說化妝不好但我很好奇那些因為化妝後外表吸引到異性而且化妝前後差異很大女生們難道不會擔心卸妝後男生會覺,"['化妝', '前後', '差異', '太大上', '大學', '和', '出', '社會', '後', '大部分', '女生', '應該', '都', '會', '化妝', '絕', '大部分', '人', '化妝', '應該', '都是', '為', '了', '讓', '外表', '更', '好看', '雖然', '不是', '說', '化妝', '不好', '但', '我', '很', '好奇', '那些', '因為', '化妝', '後', '外表', '吸引', '到', '異性', '而且', '化妝', '前後', '差異', '很大', '女生', '們', '難道', '不會', '擔心', '卸妝', '後', '男', '生會覺']"
69,239684965,載具故障,8/12載具故障無法刷，載具無法刷會用什麼？有哪裡也是一樣的狀況？,255fd275-fec2-49d2-8e46-2e1557ffaeb0,,2022-08-12 11:30:30.861000+00:00,1,0,"['故障', '載具']",閒聊,,[],載具故障812載具故障無法刷載具無法刷會用什麼有哪裡也是一樣狀況,"['載具', '故障', '812', '載具', '故障', '無法', '刷載', '具無法', '刷會用', '什麼', '有', '哪裡', '也', '是', '一樣', '狀況']"
70,239684944,公司普渡都搶到哪些戰利品？,又到了一年一度的中原普渡，在台灣，大部分的公司也會舉辦公司普渡，通常公司會將拜完的普渡食品讓員工大家下去分，但是因為通常數量有限，就變成一種有點像是搶戰利品的概念（但是趣味的那種），不知道今年大家都搶,255fd275-fec2-49d2-8e46-2e1557ffaeb0,,2022-08-12 11:27:53.277000+00:00,1,1,[],閒聊,,[],公司普渡都搶到哪些戰利品又到了一年一度中原普渡在台灣大部分公司也會舉辦公司普渡通常公司會將拜完普渡食品讓員工大家下去分但是因為通常數量有限就變成一種有點像是搶戰利品概念但是趣味那種不知道今年大家都搶,"['公司', '普渡', '都', '搶', '到', '哪些', '戰利品', '又', '到', '了', '一年一度', '中原', '普渡', '在', '台灣', '大部分', '公司', '也', '會', '舉辦', '公司', '普渡', '通常', '公司', '會將', '拜', '完普渡', '食品', '讓', '員工', '大家', '下去', '分', '但是', '因為', '通', '常數', '量', '有限', '就', '變成', '一種', '有點', '像是', '搶', '戰利品', '概念', '但是', '趣味', '那種', '不知道', '今年', '大家', '都', '搶']"
71,239684899,移民淪美政治棋子 德州已將數千人送紐約施壓拜登,（中央社紐約11日綜合外電報導）法新社報導，美國德州政府高層包下巴士將數以百計移民送抵紐約市，共和黨人爭相在美國移民政策上拿下政治分數，移民已然淪為政治棋子。報導說，40歲的廚師兼程式技術人員曼德斯（,255fd275-fec2-49d2-8e46-2e1557ffaeb0,,2022-08-12 11:20:30.944000+00:00,1,0,"['移民', '德州', '紐約', '美國', '拜登']",閒聊,,[{'url': 'https://imgur.com/qmj6IZ0.jpg'}],移民淪美政治棋子德州已將數千人送紐約施壓拜登中央社紐約11日綜合外電報導法新社報導美國德州政府高層包下巴士將數以百計移民送抵紐約市共和黨人爭相在美國移民政策上拿下政治分數移民已然淪為政治棋子報導說40歲廚師兼程式技術人員曼德斯,"['移民', '淪美政治', '棋子', '德州', '已將', '數千人', '送', '紐約', '施壓', '拜', '登', '中央社', '紐約', '11', '日', '綜合', '外電報導', '法新社', '報導', '美國德', '州政府', '高層', '包下', '巴士', '將數', '以百計', '移民送', '抵紐', '約', '市', '共和黨人', '爭相', '在', '美國', '移民政策', '上', '拿', '下政治', '分數', '移民', '已然', '淪為', '政治棋子', '報導', '說', '40', '歲', '廚師', '兼程', '式', '技術', '人員', '曼', '德斯']"
72,239684883,台版柬埔寨詐騙！南部最大賣淫集團 控23女單日進帳百萬,三立新聞網，2022年8月11日 週四 上午8：00，記者莊沛儀／台南報導，台南警方台南市警五分局去年11月獲報，以49歲王姓男子為首的人蛇賣淫集團藏身在台南火車站前的「國賓商業大樓」，經長期搜查後，,255fd275-fec2-49d2-8e46-2e1557ffaeb0,,2022-08-12 11:18:14.170000+00:00,6,14,"['閒聊', '時事']",閒聊,,[{'url': 'https://imgur.com/CHPuSXE.jpg'}],台版柬埔寨詐騙南部最大賣淫集團控23女單日進帳百萬三立新聞網2022年8月11日週四上午800記者莊沛儀／台南報導台南警方台南市警五分局去年11月獲報以49歲王姓男子為首人蛇賣淫集團藏身在台南火車站前國賓商業大樓經長期搜查後,"['台版', '柬埔寨', '詐騙', '南部', '最大賣', '淫', '集團控', '23', '女', '單日', '進帳', '百萬三立', '新聞網', '2022', '年', '8', '月', '11', '日週', '四', '上午', '800', '記者', '莊沛儀', '／', '台南', '報導', '台南', '警方', '台南市', '警五', '分局', '去年', '11', '月', '獲', '報以', '49', '歲', '王姓', '男子', '為首', '人蛇', '賣淫', '集團', '藏身', '在', '台南', '火車', '站', '前', '國賓', '商業', '大樓', '經長', '期', '搜查', '後']"
73,239684865,酪梨🥑的替代品-Ecovado,🥑Ecovado ： A sustainable alternative to avocado created using British crops and ingredients.，（圖皆擷取自他,255fd275-fec2-49d2-8e46-2e1557ffaeb0,,2022-08-12 11:14:07.688000+00:00,1,2,"['酪梨', '替代品', '時事', '好吃好吃', '有趣']",閒聊,,"[{'url': 'https://imgur.com/obsIsRy.jpg'}, {'url': 'https://imgur.com/UQ7BIf1.jpg'}, {'url': 'https://imgur.com/aIYnOGy.jpg'}]",酪梨🥑替代品Ecovado🥑EcovadoAsustainablealternativetoavocadocreatedusingBritishcropsandingredients圖皆擷取自他,"['酪', '梨', '🥑', '替代品', 'Ecovado', '🥑', 'EcovadoAsustainablealternativetoavocadocreatedusingBritishcropsandingredients', '圖皆擷', '取自', '他']"
75,239684844,喉嚨痛但醫生看不出問題,我自己上禮拜就開始喉嚨痛，只有單邊，大概這個位置，會有刺痛感，可能是因為痛的地方比較上面，所以吞口水的時候不會痛，喝水吃東西會痛，有快篩，陰性，後來過一個禮拜還在痛，就去給耳鼻喉的醫生看，醫生用棒子幫,255fd275-fec2-49d2-8e46-2e1557ffaeb0,,2022-08-12 11:12:09.102000+00:00,13,8,"['喉嚨', '醫生']",閒聊,,[{'url': 'https://imgur.com/NCQ0G4J.jpg'}],喉嚨痛但醫生看不出問題我自己上禮拜就開始喉嚨痛只有單邊大概這個位置會有刺痛感可能是因為痛地方比較上面所以吞口水時候不會痛喝水吃東西會痛有快篩陰性後來過一個禮拜還在痛就去給耳鼻喉醫生看醫生用棒子幫,"['喉嚨痛', '但', '醫生', '看', '不出', '問題', '我', '自己', '上禮', '拜', '就', '開始', '喉嚨痛', '只有', '單邊', '大概', '這個', '位置', '會', '有', '刺痛感', '可能', '是', '因為', '痛', '地方', '比較', '上面', '所以', '吞口水', '時候', '不會', '痛', '喝水', '吃', '東西會', '痛有', '快篩', '陰性', '後來', '過', '一個', '禮拜', '還在', '痛', '就', '去', '給耳', '鼻喉', '醫生', '看', '醫生', '用棒子', '幫']"
76,239684837,那些平常沒工作的人,看了看朋友們和不熟的人的限時 看起來平常沒工作 （如果有工作照理來說都會放些工作相關的限時，但那些人我就是從沒看過他們工作時的限時，也確實沒有在工作或實習什麼的，他們都跑出去玩 幾乎每天限時都是跑出去,255fd275-fec2-49d2-8e46-2e1557ffaeb0,,2022-08-12 11:11:21.068000+00:00,2,0,"['平常', '生活', '閒聊', '請益', '假日']",閒聊,,[],那些平常沒工作人看了看朋友們和不熟人限時看起來平常沒工作如果有工作照理來說都會放些工作相關限時但那些人我就是從沒看過他們工作時限時也確實沒有在工作或實習什麼他們都跑出去玩幾乎每天限時都是跑出去,"['那些', '平常', '沒', '工作', '人', '看', '了', '看', '朋友們', '和', '不熟', '人限時', '看', '起來', '平常', '沒', '工作', '如果', '有', '工作', '照理', '來說', '都', '會', '放些', '工作', '相關', '限時', '但', '那些', '人', '我', '就是', '從沒', '看過', '他們', '工作', '時限時', '也', '確實', '沒有', '在', '工作', '或', '實習', '什麼', '他們', '都', '跑', '出去玩', '幾乎', '每天限時', '都是', '跑', '出去']"
77,239684825,桃園燙染推薦之被髮廊耽誤的貓咖times salon,前段時間 實在受不頭髮太扁塌跟稻草一樣，在Google上看到times salon評論不錯，就跟朋友一起手刀預約來解決我的稻草，一進門就看到幾隻店貓有夠可愛！！，附圖  直接睡在工具車上要確定欸🥴，身,255fd275-fec2-49d2-8e46-2e1557ffaeb0,,2022-08-12 11:09:42.210000+00:00,0,2,"['美髮', '貓', '閒聊', '推薦', '生活']",閒聊,,"[{'url': 'https://imgur.com/eCwnxjc.jpg'}, {'url': 'https://imgur.com/VtNOFWF.jpg'}, {'url': 'https://vivid.dcard.tw/Public/54e73f7a-e14a-4cbe-8ce4-b960e03e6ce6/thumbnail.jpg'}, {'url': 'https://imgur.com/fTF2yIb.jpg'}, {'url': 'https://imgur.com/CpaVwlP.jpg'}, {'url': 'https://vivid.dcard.tw/Public/064110f5-6400-43e1-8861-ee59b05837cf/thumbnail.jpg'}]",桃園燙染推薦之被髮廊耽誤貓咖timessalon前段實在受不頭髮太扁塌跟稻草一樣在Google上看到timessalon評論不錯就跟朋友一起手刀預約來解決我稻草一進門就看到幾隻店貓有夠可愛附圖直接睡在工具車上要確定欸🥴身,"['桃園', '燙染', '推薦', '之', '被', '髮', '廊', '耽', '誤貓', '咖', 'timessalon', '前段', '實在', '受不頭', '髮', '太', '扁', '塌', '跟', '稻草', '一樣', '在', 'Google', '上', '看', '到', 'timessalon', '評論', '不錯', '就', '跟', '朋友', '一起', '手刀', '預約', '來', '解決', '我', '稻草', '一', '進門', '就', '看', '到', '幾隻', '店貓', '有夠', '可愛', '附圖', '直接', '睡', '在', '工具車', '上要', '確定', '欸', '🥴', '身']"
