121,239699274,你覺得命運是掌握在自己手上還是早就決定好了呢？,這個問題是從我出生到現在一直困擾著我的問題之一。我一直相信機會是留給準備好的人，所以如果不無時無刻準備好自己，就會錯過好的機會。因為這樣我不得不努力讓自己變得更好，努力不錯過這個機會。今天不知為何我的,255fd275-fec2-49d2-8e46-2e1557ffaeb0,,2022-08-14 07:25:23.161000+00:00,0,1,"['命運', '把握', '放棄', '工作', '有趣']",閒聊,,[],你覺得命運是掌握在自己手上還是早就決定好了呢這個問題是從我出生到現在一直困擾著我問題之一我一直相信機會是留給準備好人所以如果不無時無刻準備好自己就會錯過好機會因為這樣我不得不努力讓自己變得更好努力不錯過這個機會今天不知為何我,"['你', '覺得', '命運', '是', '掌握', '在', '自己', '手上', '還是', '早', '就', '決定', '好', '了', '呢', '這個', '問題', '是', '從', '我', '出生', '到', '現在', '一直', '困擾', '著', '我', '問題', '之一', '我', '一直', '相信', '機會', '是', '留給', '準備', '好', '人', '所以', '如果', '不無', '時無刻', '準備', '好', '自己', '就', '會', '錯過', '好', '機會', '因為', '這樣', '我', '不得不', '努力', '讓', '自己', '變得', '更', '好', '努力', '不錯', '過這個', '機會', '今天', '不知', '為何', '我']"
122,239699265,這種情況可以提告嗎？,今天在地方社團看到這則貼文，很是震驚，到底怎樣的疏忽才會把錢還給客人，又是怎樣的客人才會又把錢收回🤣🤣，底下留言有提到報警、提告等等，想問問這樣告的成嗎？還是只能店員自行吸收？,255fd275-fec2-49d2-8e46-2e1557ffaeb0,,2022-08-14 07:24:01.159000+00:00,4,1,"['超商', '請益', '提告']",閒聊,,[{'url': 'https://imgur.com/fOdmIfX.jpg'}],這種情況可以提告嗎今天在地方社團看到這則貼文很是震驚到底怎樣疏忽才會把錢還給客人又是怎樣客人才會又把錢收回🤣🤣底下留言有提到報警提告等等想問問這樣告成嗎還是只能店員自行吸收,"['這種', '情況', '可以', '提告', '嗎', '今天', '在', '地方', '社團', '看', '到', '這則', '貼文', '很', '是', '震', '驚', '到底', '怎樣', '疏', '忽', '才', '會', '把', '錢', '還給', '客人', '又', '是', '怎樣', '客人', '才', '會', '又', '把', '錢', '收回', '🤣', '🤣', '底下', '留言有', '提到', '報警', '提告', '等', '等', '想', '問問', '這樣', '告成', '嗎', '還是', '只能', '店員', '自行', '吸收']"
123,239699194,陳時中和館長的關係,不知道大家有沒有覺得陳時中和館長有那麼點相像，有剛好同姓陳，好想知道他們有血緣關係嗎,255fd275-fec2-49d2-8e46-2e1557ffaeb0,,2022-08-14 07:14:35.503000+00:00,1,1,"['陳時中', '館長', '有趣', '閒聊']",閒聊,,[],陳時中和館長關係不知道大家有沒有覺得陳時中和館長有那麼點相像有剛好同姓陳好想知道他們有血緣關係嗎,"['陳', '時', '中和館', '長', '關係', '不知道', '大家', '有', '沒有', '覺得', '陳', '時', '中和館', '長', '有', '那麼點', '相像', '有', '剛好', '同姓', '陳', '好', '想', '知道', '他們', '有血緣', '關係', '嗎']"
124,239699161,原來沈慧虹的交通專業是這樣！？,號稱「交通專業」的前新竹市長沈慧虹/執政七年多新竹交通一樣很爛/多起民調都指出交通問題大/現在沈還敢化身交通指揮/是不是民進黨地方的水準大概就這樣？,255fd275-fec2-49d2-8e46-2e1557ffaeb0,,2022-08-14 07:10:49.946000+00:00,10,7,"['交通', '專業', '時事', '閒聊', '台灣']",閒聊,,[],原來沈慧虹交通專業是這樣號稱交通專業前新竹市長沈慧虹執政七年多新竹交通一樣很爛多起民調都指出交通問題大現在沈還敢化身交通指揮是不是民進黨地方水準大概就這樣,"['原來', '沈慧虹', '交通', '專業', '是', '這樣', '號稱', '交通', '專業', '前新竹', '市長', '沈慧虹', '執政', '七年', '多新竹', '交通', '一樣', '很爛', '多起', '民調', '都', '指出', '交通', '問題', '大', '現在', '沈還敢', '化身', '交通指揮', '是', '不是', '民進', '黨', '地方', '水準', '大概', '就', '這樣']"
125,239699107,台北 夜店夜店～,星期日的晚上有人要去夜店嗎？內建兩男！，正好明天的行程比較晚 今天可以玩晚一點,255fd275-fec2-49d2-8e46-2e1557ffaeb0,,2022-08-14 07:02:28.709000+00:00,6,5,"['小酌', '夜店']",閒聊,,[],台北夜店夜店星期日晚上有人要去夜店嗎內建兩男正好明天行程比較晚今天可以玩晚一點,"['台北', '夜店', '夜店', '星期', '日晚', '上有', '人要', '去', '夜店', '嗎', '內建', '兩', '男正', '好', '明天', '行程', '比', '較', '晚', '今天', '可以', '玩晚', '一點']"
126,239699098,這怎麼跟柬埔寨一樣好賺啊,為什麼月入百萬，但台灣經濟還是這麼蕭條，到底把錢拿去哪裡了？By每個月達不到業績被吸引的社畜留,255fd275-fec2-49d2-8e46-2e1557ffaeb0,,2022-08-14 07:00:47.906000+00:00,19,55,"['柬埔寨', '工作', '女生', '酒店', '酒店經紀']",閒聊,,[{'url': 'https://imgur.com/fzEk9xm.jpg'}],這怎麼跟柬埔寨一樣好賺啊為什麼月入百萬但台灣經濟還是這麼蕭條到底把錢拿去哪裡了By每個月達不到業績被吸引社畜留,"['這', '怎麼', '跟', '柬埔寨', '一樣', '好賺', '啊', '為什麼', '月入', '百萬', '但', '台灣', '經濟', '還是', '這麼', '蕭條', '到底', '把', '錢', '拿', '去', '哪裡', '了', 'By', '每個', '月', '達', '不到', '業績', '被', '吸引', '社畜', '留']"
127,239699078,關於某些人群的自信心,第一次發文，排版亂請小力噴🥲，---------，我最近突然在思考一件事，是不是某些人對於自己本身條件有很高的自信心，先說本人是蠻自卑的那種人，所以一直不太能理解他們的想法跟感覺。像我有一個朋友，先說,255fd275-fec2-49d2-8e46-2e1557ffaeb0,,2022-08-14 06:57:51.945000+00:00,1,0,"['自信心', '請益']",閒聊,,[],關於某些人群自信心第一次發文排版亂請小力噴🥲我最近突然在思考一件事是不是某些人對於自己本身條件有很高自信心先說本人是蠻自卑那種人所以一直不太能理解他們想法跟感覺像我有一個朋友先說,"['關於', '某些', '人群', '自', '信心', '第', '一次', '發文', '排版亂', '請', '小力噴', '\U0001f972', '我', '最近', '突然', '在', '思考', '一件', '事是', '不是', '某些', '人', '對於', '自己', '本身', '條件', '有', '很', '高自', '信心', '先說', '本人', '是', '蠻', '自卑', '那種', '人', '所以', '一直', '不太能', '理解', '他們', '想法', '跟', '感覺', '像', '我', '有', '一個', '朋友', '先', '說']"
128,239699077,一場激烈的首都三角大戰,一場激烈的首都三角大戰，一位是姓黃的現任者，一位是民進黨派出來的陳姓候選人，一位是現任立委且受到外省族群歡迎的金童，請問這是哪一年的選舉🤔🤔🤔,255fd275-fec2-49d2-8e46-2e1557ffaeb0,,2022-08-14 06:57:49.289000+00:00,0,2,"['三角', '大戰', '時空旅人']",閒聊,,[{'url': 'https://imgur.com/lSJeh29.jpg'}],一場激烈首都三角大戰一場激烈首都三角大戰一位是姓黃現任者一位是民進黨派出來陳姓候選人一位是現任立委且受到外省族群歡迎金童請問這是哪一年選舉🤔🤔🤔,"['一場', '激烈', '首', '都', '三角', '大戰', '一場', '激烈', '首', '都', '三角', '大戰', '一位', '是', '姓黃', '現任者', '一位', '是民進', '黨', '派', '出來', '陳', '姓', '候選人', '一位', '是', '現任', '立委且', '受到', '外省', '族', '群歡', '迎金童', '請問', '這是', '哪一年', '選舉', '🤔', '🤔', '🤔']"
129,239699074,我們家樓下1樓佔用公共停車場在拜拜，可以檢舉嗎,我們家一樓最近在拜拜，他們佔到原本大家的停車空間，我機車都靠邊邊停了，他還叫我不要停在裡面，請問這個可以檢舉他們嗎，佔用公共的空間，而且這個拜拜的也不是大家會參加，還要繳錢才能參加，有法可管嗎,255fd275-fec2-49d2-8e46-2e1557ffaeb0,,2022-08-14 06:57:01.823000+00:00,2,0,"['停車場', '拜拜', '閒聊', '檢舉']",閒聊,,[],我們家樓下1樓佔用公共停車場在拜拜可以檢舉嗎我們家一樓最近在拜拜他們佔到原本大家停車空間我機車都靠邊邊停了他還叫我不要停在裡面請問這個可以檢舉他們嗎佔用公共空間而且這個拜拜也不是大家會參加還要繳錢才能參加有法可管嗎,"['我們', '家樓', '下', '1', '樓', '佔用', '公共', '停車場', '在', '拜', '拜', '可以', '檢舉', '嗎', '我們', '家', '一樓', '最近', '在', '拜', '拜', '他們', '佔', '到', '原本', '大家', '停車', '空間', '我', '機車', '都', '靠', '邊邊', '停', '了', '他', '還叫', '我', '不要', '停', '在', '裡面', '請問', '這個', '可以', '檢舉', '他們', '嗎', '佔用', '公共', '空間', '而且', '這個', '拜', '拜', '也', '不是', '大家', '會', '參加', '還要', '繳錢', '才能', '參加', '有法', '可管', '嗎']"
130,239699047,被南美洲人討厭的台灣,身邊有個不愛台灣的中南美洲朋友，她在台灣念了一年的語言學校，四年的大學，開始在台灣工作一年，和她長時間的相處後發現她真的很討厭台灣，以下舉幾個例子，感受一下為什麼她討厭台灣，1. 校園生活難融入，她說,255fd275-fec2-49d2-8e46-2e1557ffaeb0,,2022-08-14 06:52:15.527000+00:00,106,194,"['台灣', '朋友', '閒聊', '有趣', '討厭']",閒聊,,[],被南美洲人討厭台灣身邊有個不愛台灣中南美洲朋友她在台灣念了一年語言學校四年大學開始在台灣工作一年和她長相處後發現她真很討厭台灣以下舉幾個例子感受一下為什麼她討厭台灣1校園生活難融入她說,"['被', '南美洲', '人討厭', '台灣', '身邊', '有個', '不愛台灣', '中南美洲', '朋友', '她', '在', '台灣念', '了', '一年', '語言', '學校', '四年', '大學', '開始', '在', '台灣', '工作', '一年', '和', '她', '長', '相處', '後發', '現', '她', '真', '很', '討厭', '台灣', '以下', '舉', '幾個', '例子', '感受一下', '為什麼', '她', '討厭', '台灣', '1', '校園', '生活', '難融入', '她', '說']"
131,239698993,什麼樣的行為是普遍認為情侶會做的事,先不講確不確認關係，哪些事大眾意義上是情侶才做的行為，除了傳統的一到四壘以外，還有什麼行為呢,255fd275-fec2-49d2-8e46-2e1557ffaeb0,,2022-08-14 06:40:50.196000+00:00,2,0,['行為'],閒聊,,[],什麼樣行為是普遍認為情侶會做事先不講確不確認關係哪些事大眾意義上是情侶才做行為除了傳統一到四壘以外還有什麼行為呢,"['什麼樣', '行為', '是', '普遍', '認為', '情侶', '會', '做', '事先', '不', '講確', '不', '確認', '關係', '哪些', '事大眾', '意義', '上', '是', '情侶', '才', '做', '行為', '除了', '傳統', '一到', '四壘', '以外', '還有', '什麼', '行為', '呢']"
132,239698979,使柬埔寨變得不堪入目的原因之一,從影片裡，可以發現五年前（西元2017年）的柬埔寨因為有中國資金的注入、外國觀光收入而成為旅遊聖地，中國商人為當地建立交通建設、博弈產業、酒店、購物商場，並且引進大量中國人到柬埔寨，並促使當地經濟成長,255fd275-fec2-49d2-8e46-2e1557ffaeb0,,2022-08-14 06:38:52.594000+00:00,52,343,"['柬埔寨', '時事', '疫情']",閒聊,,[],使柬埔寨變得不堪入目原因之一從影片裡可以發現五年前西元2017年柬埔寨因為有中國資金注入外國觀光收入而成為旅遊聖地中國商人為當地建立交通建設博弈產業酒店購物商場並且引進大量中國人到柬埔寨並促使當地經濟成長,"['使', '柬埔寨', '變得', '不堪入目', '原因', '之一', '從', '影片', '裡', '可以', '發現', '五年', '前西元', '2017', '年', '柬埔寨', '因為', '有', '中', '國資', '金注入', '外國', '觀', '光收', '入而成', '為', '旅遊', '聖地', '中國', '商人', '為', '當地', '建立', '交通', '建設', '博弈', '產業', '酒店', '購物', '商場', '並且', '引進', '大量', '中國', '人到', '柬埔寨並', '促使', '當地', '經濟', '成長']"
133,239698950,柬埔寨詐騙也有很多看似正常的工作機會，並不是高薪聘請，也很多人不是因為貪才被騙啊,一堆人在那邊檢討被害人，但其實也很多被騙的人都是被正常薪資騙過去的，我看報導也很多人薪資在我看來都很低卻被騙啊（例如什麼情侶他們一起去，一個人薪資也才3-4萬有夠少），早在2019年，就有104上來自,255fd275-fec2-49d2-8e46-2e1557ffaeb0,,2022-08-14 06:33:36.110000+00:00,5,23,"['柬埔寨', '詐騙', '工作']",閒聊,,"[{'url': 'https://imgur.com/RaPMC66.jpg'}, {'url': 'https://imgur.com/VXQ4PqQ.jpg'}, {'url': 'https://imgur.com/BPWQmQm.jpg'}]",柬埔寨詐騙也有很多看似正常工作機會並不是高薪聘請也很多人不是因為貪才被騙啊一堆人在那邊檢討被害人但其實也很多被騙人都是被正常薪資騙過去我看報導也很多人薪資在我看來都很低卻被騙啊例如什麼情侶他們一起去一個人薪資也才34萬有夠少早在2019年就有104上來自,"['柬埔寨', '詐騙', '也', '有', '很多', '看似', '正常', '工作', '機會並', '不是', '高薪聘', '請', '也', '很多', '人', '不是', '因為', '貪才', '被', '騙', '啊', '一堆', '人', '在', '那邊', '檢討', '被', '害人', '但', '其實', '也', '很多', '被', '騙', '人', '都是', '被', '正常薪', '資騙', '過去', '我', '看', '報導', '也', '很多', '人薪資', '在我看來', '都', '很', '低', '卻', '被', '騙', '啊', '例如', '什麼', '情侶', '他們', '一起', '去', '一個人', '薪資', '也', '才', '34', '萬有夠', '少', '早', '在', '2019', '年', '就', '有', '104', '上', '來自']"
134,239698897,你騙我，我騙你 ，好一個禮尚往來,柬埔寨詐騙報出來前，前幾天才看到台灣的人蛇集團被破。不，應該說我們這裡的詐騙集團很久之前就開始了，只是現在風水輪流轉，等換到我們的人被害的時候，大家才開始重視。要不要乾脆邦交算了==,255fd275-fec2-49d2-8e46-2e1557ffaeb0,,2022-08-14 06:27:12.617000+00:00,0,5,"['時事', '詐騙', '柬埔寨', '東南亞', '人蛇集團']",閒聊,,[],你騙我我騙你好一個禮尚往來柬埔寨詐騙報出來前前幾天才看到台灣人蛇集團被破不應該說我們這裡詐騙集團很久之前就開始了只是現在風水輪流轉等換到我們人被害時候大家才開始重視要不要乾脆邦交算了,"['你', '騙', '我', '我', '騙', '你好', '一個', '禮尚', '往來', '柬埔寨', '詐騙', '報', '出來', '前前', '幾天', '才', '看', '到', '台灣', '人蛇', '集團', '被', '破', '不', '應該', '說', '我們', '這裡', '詐騙', '集團', '很', '久', '之前', '就', '開始', '了', '只是', '現在', '風水輪', '流轉', '等', '換到', '我們', '人', '被', '害', '時候', '大家', '才', '開始', '重視要', '不要', '乾脆', '邦', '交算', '了']"
135,239698878,我們要的不是高樹公路R,暑假來了 緩解天氣嚴峻以及上班上課的疲憊身軀，不少人會選擇在這時段出遊放鬆，意味著 來我們墾丁的觀光熱潮勢必再掀起一次高峰，但……，也許因為選情重要，開始搞起政績了r，直接先開始種樹 種起來，電纜那些,255fd275-fec2-49d2-8e46-2e1557ffaeb0,,2022-08-14 06:23:42.226000+00:00,3,2,"['閒聊', '公路', '傻眼']",閒聊,,[{'url': 'https://imgur.com/TcNEl0o.jpg'}],我們要不是高樹公路R暑假來了緩解天氣嚴峻以及上班上課疲憊身軀不少人會選擇在這時段出遊放鬆意味著來我們墾丁觀光熱潮勢必再掀起一次高峰但也許因為選情重要開始搞起政績了r直接先開始種樹種起來電纜那些,"['我們', '要', '不是', '高樹', '公路', 'R', '暑假來', '了', '緩解', '天氣', '嚴峻', '以及', '上班', '上課', '疲憊', '身軀', '不少', '人會', '選擇', '在', '這時', '段', '出遊', '放', '鬆', '意味著', '來', '我們', '墾丁', '觀', '光熱', '潮', '勢必', '再', '掀起', '一次', '高峰', '但', '也許', '因為', '選情', '重要', '開始', '搞', '起政績', '了', 'r', '直接', '先開', '始種', '樹種', '起', '來電', '纜', '那些']"
136,239698873,偶然間看到的新柬埔寨詐術,這個方式真的防不勝防….，用公司旅遊的方式（前提是還真的有正常給薪水…）,255fd275-fec2-49d2-8e46-2e1557ffaeb0,,2022-08-14 06:23:18.615000+00:00,6,67,"['柬埔寨', '時事']",閒聊,,[{'url': 'https://imgur.com/RuxETqw.jpg'}],偶然間看到新柬埔寨詐術這個方式真防不勝防用公司旅遊方式前提是還真有正常給薪水,"['偶然間', '看到', '新', '柬埔寨', '詐術', '這個', '方式', '真防', '不勝', '防用', '公司', '旅遊方式', '前提', '是', '還真有', '正常給', '薪水']"
137,239698866,"沒睡飽夠慘了，居然會變胖！
快把握暑假睡飽覺",吃太多動太少會變胖，是大家耳熟能詳的常識，但「睡不飽會瘦不下去」的觀念卻較少被提及，當你用盡辦法在體重機上斤斤計較時，千萬別忘了生活中最平凡卻十分重要的部分-「睡覺」睡眠怎麼影響體重？1⃣️增加食慾，之前,255fd275-fec2-49d2-8e46-2e1557ffaeb0,,2022-08-14 06:22:04.072000+00:00,1,2,"['胖', '暑假', '工作', '女生', '閒聊']",閒聊,,"[{'url': 'https://imgur.com/N1mS0Of.jpg'}, {'url': 'https://imgur.com/h0MEGFH.jpg'}, {'url': 'https://imgur.com/YIApmA2.jpg'}, {'url': 'https://imgur.com/j725Cy1.jpg'}, {'url': 'https://imgur.com/Euvywhx.jpg'}]",沒睡飽夠慘了居然會變胖快把握暑假睡飽覺吃太多動太少會變胖是大家耳熟能詳常識但睡不飽會瘦不下去觀念卻較少被提及當你用盡辦法在體重機上斤斤計較時千萬別忘了生活中最平凡卻十分重要部分睡覺睡眠怎麼影響體重1⃣️增加食慾之前,"['沒睡', '飽夠', '慘了', '居然', '會變', '胖快', '把', '握暑', '假睡', '飽覺', '吃', '太多動', '太少會', '變胖', '是', '大家', '耳熟', '能', '詳', '常識', '但', '睡', '不', '飽會', '瘦', '不', '下去', '觀念', '卻', '較', '少', '被', '提及當', '你', '用', '盡', '辦法', '在', '體重', '機上', '斤斤', '計較', '時', '千萬', '別忘了', '生活', '中', '最', '平凡', '卻', '十分', '重要', '部分', '睡覺', '睡眠', '怎麼', '影響', '體重', '1', '⃣', '️', '增加', '食', '慾', '之前']"
139,239698850,柬埔寨真實畫面在這邊,https：//，可能要複製這個網址貼上才看的到。記得自己把//跟後面的接上，歡迎來到柬埔寨，這裡是腰子說沒就沒的地方，歡迎來到地獄，尊貴的O型血。影片看起來是bili那邊找的片段剪接而成，說明處有影,255fd275-fec2-49d2-8e46-2e1557ffaeb0,,2022-08-14 06:19:52.475000+00:00,5,84,"['柬埔寨', '畫面', '場景', '時事', '工作']",閒聊,,[],柬埔寨真實畫面在這邊可能要複製這個網址貼上才看到記得自己把跟後面接上歡迎來到柬埔寨這裡是腰子說沒就沒地方歡迎來到地獄尊貴O型血影片看起來是bili那邊找片段剪接而成說明處有影,"['柬埔寨', '真實', '畫面', '在', '這邊', '可能', '要', '複', '製', '這', '個', '網', '址', '貼', '上', '才', '看', '到', '記', '得', '自', '己', '把', '跟', '後面', '接上', '歡迎', '來到', '柬埔寨', '這裡', '是', '腰子', '說', '沒', '就', '沒', '地方', '歡迎', '來到', '地獄', '尊貴', 'O型', '血', '影片', '看起', '來', '是', 'bili', '那邊', '找片', '段', '剪接', '而', '成說', '明處', '有影']"
140,239698832,用小米產品用到生氣,大家都是用小米什麼產品呢？之前買了感應小夜燈結果用不到幾次電池就沒電了，常常需要換電池，隔一段時間感應器出問題，有時候沒有經過它會自己亮燈，或是關燈經過它不亮了，換了新的電池也常常故障🥲，還有用過相片,255fd275-fec2-49d2-8e46-2e1557ffaeb0,,2022-08-14 06:16:33.215000+00:00,2,3,"['小米', '產品', '生氣']",閒聊,,[],用小米產品用到生氣大家都是用小米什麼產品呢之前買了感應小夜燈結果用不到幾次電池就沒電了常常需要換電池隔一段感應器出問題有時候沒有經過它會自己亮燈或是關燈經過它不亮了換了新電池也常常故障🥲還有用過相片,"['用', '小米', '產品', '用', '到', '生氣', '大家', '都是', '用', '小米', '什麼', '產品', '呢', '之前', '買', '了', '感應', '小夜燈', '結果', '用', '不到', '幾次', '電池', '就', '沒電', '了', '常常', '需要', '換電池', '隔', '一段', '感應器', '出', '問題', '有', '時候', '沒有', '經過', '它', '會', '自己', '亮燈', '或是', '關燈', '經過', '它', '不亮', '了', '換了', '新電池', '也', '常常', '故障', '\U0001f972', '還有', '用過', '相片']"
141,239698822,束褲,想問一下 束褲能不能防曬啊？？,255fd275-fec2-49d2-8e46-2e1557ffaeb0,,2022-08-14 06:15:08.056000+00:00,1,2,['束褲'],閒聊,,[],束褲想問一下束褲能不能防曬啊,"['束褲', '想問', '一下', '束褲', '能', '不能', '防曬', '啊']"
142,239698789,如果朋友很美 你們會誇獎嗎,如題，我是T，身邊有兩個美女朋友A和B，也有一些比較普的朋友C D E，我們都是同一個生活圈 平會出去玩，A、B美的程度大概是走在路上會被各種男生偷看，偶爾會遇到搭訕的，我審美應該沒出問題 所以常常稱,255fd275-fec2-49d2-8e46-2e1557ffaeb0,,2022-08-14 06:10:58.253000+00:00,2,1,"['朋友', '稱讚', '正妹', '普妹']",閒聊,,[],如果朋友很美你們會誇獎嗎如題我是T身邊有兩個美女朋友A和B也有一些比較普朋友CDE我們都是同一個生活圈平會出去玩AB美程度大概是走在路上會被各種男生偷看偶爾會遇到搭訕我審美應該沒出問題所以常常稱,"['如果', '朋友', '很美', '你們', '會', '誇獎', '嗎', '如題', '我', '是', 'T', '身邊', '有', '兩個', '美', '女朋友', 'A', '和', 'B', '也', '有', '一些', '比較', '普朋友', 'CDE', '我們', '都是', '同一個', '生活', '圈', '平會', '出去玩', 'AB', '美程度', '大概', '是', '走', '在', '路上', '會', '被', '各種', '男生', '偷看', '偶爾', '會遇', '到', '搭訕', '我', '審美', '應該', '沒出', '問題', '所以', '常常', '稱']"
144,239698757,我的牙齦QAQ,請問我的牙齦怎麼了 好痛，前幾天吃雞被骨頭刮到過，它會自己好嗎？？防雷圖，.，.，.，.，.，.，.，.，.，.，.，.，.，.，.，.，.，..，.，.,255fd275-fec2-49d2-8e46-2e1557ffaeb0,,2022-08-14 06:05:12.619000+00:00,1,0,"['牙齦', '痛']",閒聊,,"[{'url': 'https://imgur.com/hSwNeNi.jpg'}, {'url': 'https://imgur.com/Te2eBhw.jpg'}]",我牙齦QAQ請問我牙齦怎麼了好痛前幾天吃雞被骨頭刮到過它會自己好嗎防雷圖,"['我牙齦', 'QAQ', '請問', '我牙齦', '怎麼', '了', '好', '痛前', '幾天', '吃', '雞', '被', '骨頭', '刮', '到過', '它', '會', '自己', '好', '嗎', '防雷圖']"
145,239698711,支持下修總統候選人年齡限制！,管你什麼藍綠鬥爭！檯面上政治人物真正為人民著想的沒幾個，還不如選一個賞心悅目的️，無條件支持總統候選人年齡限制，讓我們的紫渝能夠為全台灣的人民來服務，相信愛與和平在紫渝當上總統後一定能實現！，紫渝紫渝我,255fd275-fec2-49d2-8e46-2e1557ffaeb0,,2022-08-14 05:59:55.101000+00:00,10,24,"['總統', '年齡', '時事', '有趣', '生活']",閒聊,,[{'url': 'https://imgur.com/cf8YAzI.jpg'}],支持下修總統候選人年齡限制管你什麼藍綠鬥爭檯面上政治人物真正為人民著想沒幾個還不如選一個賞心悅目️無條件支持總統候選人年齡限制讓我們紫渝能夠為全台灣人民來服務相信愛與和平在紫渝當上總統後一定能實現紫渝紫渝我,"['支持', '下修', '總統', '候選人', '年齡', '限制', '管', '你', '什麼', '藍綠鬥爭', '檯', '面上', '政治', '人物', '真正為', '人民', '著想', '沒', '幾個', '還', '不如', '選', '一個', '賞心', '悅目', '️', '無條件', '支持', '總統', '候選人', '年齡', '限制', '讓我', '們', '紫渝能夠', '為', '全台灣', '人民', '來', '服務', '相信', '愛與', '和平', '在', '紫渝當', '上', '總', '統後一', '定能', '實現', '紫渝紫渝', '我']"
